"Salsa De Soya Premium LEE KUM KEE 8 ml.  ","Salsa De Soya Premium  ","Premium Soy Sauce","Premium Soy Sauce, Regular Soy Sauce Sachet","LEE KUM KEE","8","","CHINA","8ml, 150ml, 500ml, 12.8lt","RSiA17M44996","42599","","NO","Sachet","9.5x0.3x4.3","5960","12","16","","500","SALSA SOYA REGULAR SACHET LKK  500x8 ml","Agua,Sal,Frijol De Soya,Azucar,Harina De Trigo,Colorante,Acidolactico,Realzadores De Sabor,Conservante","Salsa De Soya Estilo China Hecha De Soya Y Trigo Fermentado Naturalmente","Condimentar,Sazonar Y Marinar Vegetales Y Mariscos","","Caja","500","","6,1","14x33.5x24.5","","078895131529","01-99004","CHINA","LEE KUM KEE","CHINA","SI","","6","LKK","simple","Default","56034,48","Enabled","Catalog, Search","cada 8ml contiene:; proteinas 0,9g; calorias 5; grasas 0g; carbohidratos 1g; sodio 550mg","/productos/salsas/salsa-de-soya-regular-sachet-lkk.jpg","empaque de venta al mayoreo: tipo de empaque: Caja; unidades: 1; sub-empaque interno: N.A; peso neto (Kg): 2980; peso bruto (Kg): 6,1; dimensiones del empaque (cm) (AxAxP): 14x33.5x24.5","100","1","1" 
"Salsa De Soya Premium Oscura LEE KUM KEE 12.8 lt.","Salsa De Soya Premium Oscura","Premium Dark Soy Sauce","Premium Dark Soy Sauce, Salsa De Soja, Shoyu","LEE KUM KEE","12800","","CHINA","500ml","RSiA17M44996","42599","","NO","Bidon","32.5x26x19","16000","12","16","","1","SALSA SOYA PREMIUN OSCURA LKK x15kL","Agua,Sal,Frijol De Soya,Azucar,Harina De Trigo,Colorante,Acidolactico,Realzadores De Sabor,Conservante","Salsa De Soya Estilo China Hecha De Soya, Trigo, Y Caramelo Fermentado Naturalmente","Condimentar,Sazonar Y Marinar Vegetales Y Mariscos","","Caja","1","","16,4","34.5x27x21","","078895132502","01-13249","CHINA","LEE KUM KEE","CHINA","SI","","6","LKK","simple","Default","129310,34","Enabled","Catalog, Search","cada 15 ml contiene:; proteinas 1g; calorias 15; grasas 0g; carbohidratos 1,1g; azucar 0,9g; sodio 1030 mg","/productos/salsas/salsa-soya-premium-oscura-15kl-lkk.jpg","empaque de venta al mayoreo: tipo de empaque: Caja; unidades: 1; sub-empaque interno: N.A; peso neto (Kg): 16; peso bruto (Kg): 16,4; dimensiones del empaque (cm) (AxAxP): 34.5x27x21","100","1","1" 
"Salsa De Soya Premium Oscura LEE KUM KEE 500 ml.","Salsa De Soya Premium Oscura","Premium Dark Soy Sauce","Premium Dark Soy Sauce, Salsa De Soja, Shoyu","LEE KUM KEE","500","","CHINA","12,8lt","RSiA17M44996","42599","","NO","Frasco","25x7x7","936","18","16","","12","SALSA SOYA SUPR PREMIUN   LKK 12x500ml","Agua,Sal,Frijol De Soya,Azucar,Harina De Trigo,Colorante,Acidolactico,Realzadores De Sabor,Conservante","Salsa De Soya Estilo China Hecha De Soya, Trigo, Y Caramelo Fermentado Naturalmente","Condimentar,Sazonar Y Marinar Vegetales Y Mariscos","","Caja","12","","10,97","27x30x23","","078895126389","01-12638","CHINA","LEE KUM KEE","CHINA","","SI","6","LKK","simple","Default","6896,55","Enabled","Catalog, Search","cada 15 ml contiene:; proteinas 1g; calorias 15; grasas 0g; carbohidratos 1,1g; azucar 0,9g; sodio 1030 mg","/productos/salsas/salsa-soya-premium-oscura-500ml-lkk.jpg","empaque de venta al mayoreo: tipo de empaque: Caja; unidades: 12; sub-empaque interno: N.A; peso neto (Kg): 11,232; peso bruto (Kg): 10,97; dimensiones del empaque (cm) (AxAxP): 27x30x23","100","1","1" 
"Salsa De Soya Regular KIKKOMAN 148 ml.","Salsa De Soya Regular","Regular Soy Sauce","Regular Soy Sauce, Salsa De Soja, Shoyu","KIKKOMAN","148","","USA","3.79lt, 291ml, 591ml, 18.9lt","USO INSTITUCIONAL","","","NO","Frasco","13,5x6,2x6,2","350","24","16","","12","SALSA SOYA KIKKOMAN REGDISP JFC 12x148ml","Agua, Trigo, Frijol De Soya, Sal, Benzoato De Sodio","Salsa De Soya Estilo Japones Hecha De Soya Y Trigo Fermentado Naturalmente ","","","Caja","12","","4,4","15x27x21","","04139946","08-13994","USA","KIKKOMAN FOODS INC","USA","SI","","6","JFC","simple","Default","","Enabled","Catalog, Search","cada 15 ml contiene:; proteinas 2g; calorias 10; grasa 0g; carbohidratos 0g; sodio 920mg","/productos/salsas/salsa-de-soya-regular-kikkoman-dispensador.jpg","empaque de venta al mayoreo: tipo de empaque: Caja; unidades: ; sub-empaque interno: N.A; peso neto (Kg): 4,2; peso bruto (Kg): 4,4; dimensiones del empaque (cm) (AxAxP): 15x27x21","100","1","1" 
"Salsa De Soya Regular KIKKOMAN 291 ml.","Salsa De Soya Regular","Regular Soy Sauce","Regular Soy Sauce, Salsa De Soja, Shoyu","KIKKOMAN","291","","USA","148ml, 3.79lt, 591ml, 18.9lt","","","","","Frasco","","","12","16","","","","Agua, Trigo, Frijol De Soya, Sal, Benzoato De Sodio","Salsa De Soya Estilo Japones Hecha De Soya Y Trigo Fermentado Naturalmente ","","","","","","","","","","","USA","KIKKOMAN FOODS INC","","SI","","6","JFC","simple","Default","","Enabled","Catalog, Search","cada 15 ml contiene:; proteinas 2g; calorias 10; grasa 0g; carbohidratos 0g; sodio 920mg","","empaque de venta al mayoreo: tipo de empaque: ; unidades: ; sub-empaque interno: N.A; peso neto (Kg): ; peso bruto (Kg): ; dimensiones del empaque (cm) (AxAxP): ","100","1","1" 
"Salsa De Soya Regular KIKKOMAN 3.79 lt.","Salsa De Soya Regular","Regular Soy Sauce","Regular Soy Sauce, Salsa De Soja, Shoyu","KIKKOMAN","379","","USA","148ml, 291ml, 591ml, 18.9lt","USO INSTITUCIONAL","","","NO","Lata","25X17X11","4755","12","16","","12","SALSA SOYA KIKKOMAN JFC 4x1 gl","Agua, Trigo, Frijol De Soya, Sal, Benzoato De Sodio","Salsa De Soya Estilo Japones Hecha De Soya Y Trigo Fermentado Naturalmente ","","","Caja","12","","20,5","27,5x23,5x37","","41390001604","08-00160","USA","KIKKOMAN FOODS INC","USA","SI","","6","JFC","simple","Default","60344,82","Enabled","Catalog, Search","cada 15 ml contiene:; proteinas 2g; calorias 10; grasa 0g; carbohidratos 0g; sodio 920mg","/productos/salsas/salsa-de-soya-regular-kikkoman-3.79l.jpg","empaque de venta al mayoreo: tipo de empaque: Caja; unidades: ; sub-empaque interno: N.A; peso neto (Kg): 57,06; peso bruto (Kg): 20,5; dimensiones del empaque (cm) (AxAxP): 27,5x23,5x37","100","1","1" 
"Salsa De Soya Regular KIKKOMAN 591 ml.","Salsa De Soya Regular","Regular Soy Sauce","Regular Soy Sauce, Salsa De Soja, Shoyu","KIKKOMAN","591","","USA","148ml, 3.79lt, 291ml, 18.9lt","USO INSTITUCIONAL","","","","Frasco","23,2x7x7","940","12","16","","12","SALSA SOYA KIKKOMAN JFC 12  x  591ml","Agua, Trigo, Frijol De Soya, Sal, Benzoato De Sodio","Salsa De Soya Estilo Japones Hecha De Soya Y Trigo Fermentado Naturalmente ","","","","12","","12,5","25x25x33","","04139344","08-13934","USA","KIKKOMAN FOODS INC","USA","SI","","6","JFC","simple","Default","23275,86","Enabled","Catalog, Search","cada 15 ml contiene:; proteinas 2g; calorias 10; grasa 0g; carbohidratos 0g; sodio 920mg","/productos/salsas/salsa-de-soya-regular-kikkoman-591ml.jpg","empaque de venta al mayoreo: tipo de empaque: ; unidades: ; sub-empaque interno: N.A; peso neto (Kg): 11,28; peso bruto (Kg): 12,5; dimensiones del empaque (cm) (AxAxP): 25x25x33","100","1","1" 
"Salsa De Soya Regular KIKKOMAN 18.9 lt.","Salsa De Soya Regular","Regular Soy Sauce","Regular Soy Sauce, Salsa De Soja, Shoyu","KIKKOMAN","18900","","USA","148ml, 3.79lt, 291ml, 591ml","USO INSTITUCIONAL","","","","Cuñete","38x31x31","23660","12","16","","1","SALSA SOYA KIKKOMAN JFC x 5gls","Agua, Trigo, Frijol De Soya, Sal, Benzoato De Sodio","Salsa De Soya Estilo Japones Hecha De Soya Y Trigo Fermentado Naturalmente Para Uso En Restaurantes","","","","1","","","","","41390001823","08-00182","USA","KIKKOMAN FOODS INC","","SI","","6","JFC","simple","Default","","Enabled","Catalog, Search","cada 15 ml contiene:; proteinas 2g; calorias 10; grasa 0g; carbohidratos 0g; sodio 920mg","/productos/salsas/salsa-de-soya-regular-kikkoman-18.9Lt.jpg","empaque de venta al mayoreo: tipo de empaque: ; unidades: ; sub-empaque interno: N.A; peso neto (Kg): ; peso bruto (Kg): ; dimensiones del empaque (cm) (AxAxP): ","100","1","1" 
"Salsa De Soya Regular LEE KUM KEE 12.8 lt.","Salsa De Soya Regular","Premium Soy Sauce","Premium Soy Sauce, Salsa De Soja, Shoyu","LEE KUM KEE","12800","","CHINA","8ml, 150ml, 500ml","RSiA17M44996","42599","","NO","Bidon","32.5x26x19","16000","12","16","","1","SALSA SOYA SUPERIOR LIGTH LKK x15kl","Agua,Sal,Frijol De Soya,Azucar,Harina De Trigo,Colorante,Acidolactico,Realzadores De Sabor,Conservante","Salsa De Soya Clara Estilo China En Bidon Para Uso En Restaurantes","Condimentar,Sazonar Y Marinar Vegetales Y Mariscos","","Caja","1","","16,4","34.5x27x21","","078895132502","01-13249","CHINA","LEE KUM KEE","CHINA","SI","","6","LKK","simple","Default","","Enabled","Catalog, Search","","/productos/salsas/salsa-de-soya-regular-15kl-lkk.jpg","empaque de venta al mayoreo: tipo de empaque: Caja; unidades: 1; sub-empaque interno: N.A; peso neto (Kg): 16; peso bruto (Kg): 16,4; dimensiones del empaque (cm) (AxAxP): 34.5x27x21","100","1","1" 
"Salsa De Soya Table Top LEE KUM KEE 150 ml.","Salsa De Soya Sobremesa","Soy Sauce","Soy Sauce, Salsa De Soja, Shoyu","LEE KUM KEE","150","","CHINA","8ml, 500ml, 12.8lt","RSiA17M44996","42599","","NO","Frasco","14x7x7","392","18","16","","12","SALSA SOYA TABLE TOP REG. LKK 12x150 ml","Agua,Sal,Frijol De Soya,Azucar,Harina De Trigo,Colorante,Acidolactico,Realzadores De Sabor,Conservante","Salsa De Soya Clara Estilo China Para Usarse En La Mesa","Condimentar,Sazonar Y Marinar Vegetales Y Mariscos","","Caja","12","","10,97","15x23x15.5","","078895128833","01-12883","CHINA","LEE KUM KEE","CHINA","SI","","6","LKK","simple","Default","5603,44","Enabled","Catalog, Search","cada 15 ml contiene:; proteinas 0,7g; calorias 39KJ; grasas 0g; carbohidratos 0,2g; azucar 1,4g; fibra dietetica 0g; sodio 1150 mg","/productos/salsas/salsa-de-soya-150ml-lkk.jpg","empaque de venta al mayoreo: tipo de empaque: Caja; unidades: 12; sub-empaque interno: N.A; peso neto (Kg): 4,704; peso bruto (Kg): 10,97; dimensiones del empaque (cm) (AxAxP): 15x23x15.5","100","1","1" 
"Salsa Fina De Camarones LEE KUM KEE 227 ml.","Salsa Fina De Camarones","Shrimp Sauce (Finely Ground)","Shrimp Sauce (Finely Ground), Belacan, Bagoong","LEE KUM KEE","227","","CHINA","","USO INSTITUCIONAL","","","NO","Frasco","12x7x7","574","12","16","","12","SALSA FINA DE CAMARON 12x340Gr","Camarones Fermentados,Sal","Salsa A Base De Camarones Fermentados Y Molidos Finamente","Salteados, Resalta El Sabor De Los Ingredientes","","Bandeja","12","","7,53","12x30x22","","078895400021","01-40001","CHINA","LEE KUM KEE","CHINA","SI","","6","LKK","simple","Default","19827,58","Enabled","Catalog, Search","cada 5 ml contiene:; proteinas 1g; calorias 5; grasas 0g; carbohidratos 0g; colesterol 25mg; sodio 590 mg","/productos/salsas/salsa-fina-de-camarones-lkk.jpg","empaque de venta al mayoreo: tipo de empaque: Bandeja; unidades: 12; sub-empaque interno: N.A; peso neto (Kg): 6,888; peso bruto (Kg): 7,53; dimensiones del empaque (cm) (AxAxP): 12x30x22","100","1","1" 
"Salsa Fina Picante LEE KUM KEE","Salsa Fina Picante","Fine Chili Sauce","Fine Chili Sauce","LEE KUM KEE","","453","HONG KONG","","RSiA17M43096","42599","","","Frasco","","","","16","","12","FINE CHILI SAUCE LKK 12 x 453 Gr","","Salsa Suave De Chile Picante Y Amargo","","","Caja","12","","","","","","01-30036","CHINA","LEE KUM KEE","","SI","","6","LKK","simple","Default","","Enabled","Catalog, Search","","","empaque de venta al mayoreo: tipo de empaque: Caja; unidades: 12; sub-empaque interno: N.A; peso neto (Kg): ; peso bruto (Kg): ; dimensiones del empaque (cm) (AxAxP): ","100","1","1" 
"Salsa Ground Bean LEE KUM KEE 306 ml.","Salsa Ground Bean","Groun Bean Sauce","Groun Bean Sauce","LEE KUM KEE","306","","CHINA","","USO INSTITUCIONAL","","","NO","Frasco","12x7x7","586","12","16","","12","SALSA GROUND BEAN LKK 12X306ML ","Pasta Fermentada De Soya,Salsa Soya,Azucar,Agua,Harina De Maiz Modificada,Sal","Salsa Hecha Con El Residuo Solido Obtenido En La Produccion De La Salsa De Soya","","","Bandeja","12","","7,53","12x30x22","","078895720570","01-11111","CHINA","LEE KUM KEE","CHINA","SI","","6","LKK","simple","Default","9482,75","Enabled","Catalog, Search","","/productos/salsas/salsa-ground-bean-lkk.jpg","empaque de venta al mayoreo: tipo de empaque: Bandeja; unidades: 12; sub-empaque interno: N.A; peso neto (Kg): 7,032; peso bruto (Kg): 7,53; dimensiones del empaque (cm) (AxAxP): 12x30x22","100","1","1" 
"Salsa Hoisin LEE KUM KEE 2.27 kg.","Salsa Hoisin","Hoisin Sauce","Hoisin Sauce","LEE KUM KEE","","2270","CHINA","240g","RSiA17M43096","42599","","NO","Lata","11.6x15.5x15.5","2536","36","16","","6","SALSA HOISIN LKK 6x5lbs","Azucar,Agua,Pasta De Soya Fermentada,Extracto De Especias,Bonito En Polvo,Colorantes,Almidon Alimenticio Modificado,Pasta De Semilla De Ajonjoli,Ajo En Polvo,Pimenton Salado,Acido Alimenticio","Salsa China A Base De La Papa Dulce Y Especias Y Condimentos Chinos Para Uso En Restaurantes","Principalmente Como Condimento O Dip, Tambien Excelente Para Hornear,Freir O Cocinar A La Parrilla","","Caja","6","","15,37","12.5x48x32.5","","078895700053","01-70005","CHINA","LEE KUM KEE","CHINA","SI","","6","LKK","simple","Default","31896,55","Enabled","Catalog, Search","cada 42g contiene:; proteinas 0,7g; calorias 102; grasa 0,7g; grasa saturada 0,1g; carbohidratos 2g; azucar 21g; fibra dietetica 0,5g; sodio 1080 mg ","/productos/salsas/salsa-hoisin-5lb-lkk.jpg","empaque de venta al mayoreo: tipo de empaque: Caja; unidades: 6; sub-empaque interno: N.A; peso neto (Kg): 15,216; peso bruto (Kg): 15,37; dimensiones del empaque (cm) (AxAxP): 12.5x48x32.5","100","1","1" 
"Salsa Hoisin LEE KUM KEE 240 g.","Salsa Hoisin","Hoisin Sauce","Hoisin Sauce","LEE KUM KEE","","240","CHINA","2.27kg","RSiA17M43096","42599","","NO","Frasco","9x6.5x6.5","436","36","16","","12","SALSA HOISIN LKK 12x240gr","Azucar,Agua,Pasta De Soya Fermentada,Extracto De Especias,Bonito En Polvo,Colorantes,Almidon Alimenticio Modificado,Pasta De Semilla De Ajonjoli,Ajo En Polvo,Pimenton Salado,Acido Alimenticio","Salsa China A Base De La Papa Dulce Y Especias Y Condimentos Chinos Para Uso Casero","Principalmente Como Condimento O Dip, Tambien Excelente Para Hornear,Freir O Cocinar A La Parrilla","","Bandeja","12","","5,05","12x30x22","","078895700015","01-70001","CHINA","LEE KUM KEE","CHINA","","SI","6","LKK","simple","Default","7758,62","Enabled","Catalog, Search","cada 42g contiene:; proteinas 0,7g; calorias 102; grasa 0,7g; grasa saturada 0,1g; carbohidratos 2g; azucar 21g; fibra dietetica 0,5g; sodio 1080 mg ","/productos/salsas/salsa-hoisin-240-lkk.jpg","empaque de venta al mayoreo: tipo de empaque: Bandeja; unidades: 12; sub-empaque interno: N.A; peso neto (Kg): 5,232; peso bruto (Kg): 5,05; dimensiones del empaque (cm) (AxAxP): 12x30x22","100","1","1" 
"Salsa Picante Con Ajos LEE KUM KEE 2.13 kg.","Salsa Picante Con Ajos","Chili Garlic Sauce","Chili Garlic Sauce","LEE KUM KEE","","2130","CHINA","226g","RSiA17M43096","42599","","NO","Lata","11.6x15.5x15.5","2380","36","16","","6","SALSA PICANTE CON AJOS LKK 6x4lbs","Aji Salado,Azucar,Ajo,Agua,Vinagre De Arroz,Almidon De Maiz Modificado,Sal,Acido Lactico,Acido Citrico,Ajo En Polvo,Goma De Xantano","Salsa De Aji Chino Con Ajos Para Uso En Restaurantes","Salteados, Mezclado Con Soya U Otras Salsas","","Bandeja","6","","5,05","12x30x22","","078895770032","01-77001","CHINA","LEE KUM KEE","CHINA","SI","","6","LKK","simple","Default","","Enabled","Catalog, Search","","/productos/salsas/salsa-picante-con-ajos-5lb-lkk.jpg","empaque de venta al mayoreo: tipo de empaque: Bandeja; unidades: 12; sub-empaque interno: N.A; peso neto (Kg): 14,28; peso bruto (Kg): 5,05; dimensiones del empaque (cm) (AxAxP): 12x30x22","100","1","1" 
"Salsa Picante Con Ajos LEE KUM KEE 226 g.","Salsa Picante De Ajos","Chili Garlic Sauce","Chili Garlic Sauce","LEE KUM KEE","","226","CHINA","2.13kg","RSiA17M43096","42599","","NO","Frasco","9x6.5x6.5","412","36","16","","12","SALSA PICANTE CON AJOS LKK 12x226g","Aji Salado,Azucar,Ajo,Agua,Vinagre De Arroz,Almidon De Maiz Modificado,Sal,Acido Lactico,Acido Citrico,Ajo En Polvo,Goma De Xantano","Salsa De Aji Chino Con Ajos Para Uso Casero","Salteados, Mezclado Con Soya U Otras Salsas","","Caja","12","","15,37","12.5x48x32.5","","078895770018","01-77003","CHINA","LEE KUM KEE","CHINA","","SI","6","LKK","simple","Default","7758,62","Enabled","Catalog, Search","","/productos/salsas/salsa-picante-con-ajos-226-lkk.jpg","empaque de venta al mayoreo: tipo de empaque: Caja; unidades: 6; sub-empaque interno: N.A; peso neto (Kg): 4,944; peso bruto (Kg): 15,37; dimensiones del empaque (cm) (AxAxP): 12.5x48x32.5","100","1","1" 
"Salsa Premium Sabor Ostion LEE KUM KEE 255 g.","Salsa Premium Sabor Ostion","Premium Oyster Sauce","Premium Oyster Sauce, Salsa De Ostras","LEE KUM KEE","","255","HONG KONG","","RSiA17M46696","42634","","NO","Frasco","19.5x5x5","456","48","16","","12","SALSA OSTRAS PREMIUM LKK 12x255","Agu,Azucar,Extracto De Ostion,Almidon De Maiz,Harina De Trigo,Colorante","Salsa Hecha Con Extracto Concentrado De Ostras Para Resaltar El Sabor Del Plato ","Fundamental En La Cocina China, Para Saltear Al Woky Para Marinar Todo Tipo De Carnes","","Caja","12","","5,71","20x21.5x16","","078895100013","01-10001","HONG KONG","LEE KUM KEE","HONG KONG","","SI","6","LKK","simple","Default","","Enabled","Catalog, Search","","/productos/salsas/salsa-de-ostion-suprema-lkk.jpg","empaque de venta al mayoreo: tipo de empaque: Caja; unidades: 12; sub-empaque interno: N.A; peso neto (Kg): 5,472; peso bruto (Kg): 5,71; dimensiones del empaque (cm) (AxAxP): 20x21.5x16","100","1","1" 
"Salsa Sambal Oelek SREE 454 g.","Salsa Sambal Oelek","Chili Paste","Chili Paste","SREE BRAND","454","","TAILANDIA","","USO INSTITUCIONAL","","","NO","Frasco","12,5X7,5X7,5","746","12","16","","24","SALSA SAMBAL OLEK THAI 24x454Gr","Chile Rojo, Sal, Agua, Vinagre, Benzoato De Sodio","Salsa De Aji Picante Triturado Al Estilo Malayo","Salteados Con Pollo, Cerdo, Verduras O Pescado","","Caja","24","","21,3","41x27x33","","8850344060237","04-60237","TAILANDIA","SUREE INTERFOODS CO","TAILANDIA","SI","","6","THAI","simple","Default","10344,82","Enabled","Catalog, Search","cada 100g contiene:; proteinas 0,5g; calorias 271Kcal; grasa 1,1g; carbohidratos 65,1g; sodio 0,7mg, fibra dietetica: 1,3g ","/productos/salsas/salsa-sambal-oelek-sree-454g.jpg","empaque de venta al mayoreo: tipo de empaque: Caja; unidades: 24; sub-empaque interno: N.A; peso neto (Kg): 17,904; peso bruto (Kg): 21,3; dimensiones del empaque (cm) (AxAxP): 41x27x33","100","1","1" 
"Salsa Sriracha HUY FONG 740 g.","Salsa Sriracha","Sriracha Sauce","Sriracha Sauce, Rooster, Gallo","HUY FONG","","740","USA","","USO INSTITUCIONAL","","","NO","Frasco Pet","24,4x7,6x7,6","890","12","16","","12","SALSA SRIRACHA JFC 12x793g","Chiles, Azucar , Sal, Ajo, Vinagre, Sorbato De Potasia, Bisulfito De Sodio, Goma De Xanthan","Salsa De Aji Picante Estilotailandes","Salteados Con Pollo, Cerdo, Verduras O Pescado, Sushi Picante","","Caja","12","","11.06","25,8x32x24,5","","24463061163","08-06116","USA","HUY FONG FOODS INC","USA","SI","","6","JFC","simple","Default","18965,51","Enabled","Catalog, Search","cada 5g contiene:; proteinas 0g; calorias 5; grasa 0g; carbohidratos 1g; sodio 100 mg ","/productos/salsas/salsa-sriracha-huy-fong-740g.jpg","empaque de venta al mayoreo: tipo de empaque: Caja; unidades: 12; sub-empaque interno: N.A; peso neto (Kg): 10,68; peso bruto (Kg): 11.06; dimensiones del empaque (cm) (AxAxP): 25,8x32x24,5","100","1","1" 
"Salsa De Tamarindo TALAD THAI  2 kg.","Salsa De Tamarindo","Tamarind Sauce","Tamarind Sauce","TALAD THAI","","2000","TAILANDIA","250g","USO INSTITUCIONAL","","","NO","Frasco Pet","26x12x12","2100","12","16","","6","PASTA DE TAMARINDO THAI 6x2k","Agua, Tamarindo","Salsa De La Pulpa Del Tamarindo Tailandes","Salteados Tai Y Vietnamitas Con Pollo, Cerdo, Verduras O Pescado","","Caja","6","","13,24","31x37x24,5","","8850313000905","05-0905","TAILANDIA","THAIMARKET AGRICULTURE CO","TAILANDIA","SI","","6","THAI","simple","Default","51724,13","Enabled","Catalog, Search","cada 12g contiene:; proteinas 0g; calorias 10; grasa 0g; carbohidratos 3g; sodio 90mg ","/productos/salsas/pasta-de-tamarindo-2k.jpg","empaque de venta al mayoreo: tipo de empaque: Caja; unidades: 6; sub-empaque interno: N.A; peso neto (Kg): 12,6; peso bruto (Kg): 13,24; dimensiones del empaque (cm) (AxAxP): 31x37x24,5","100","1","1" 
"Salsa Teriyaki KIKKOMAN 296ml.","Salsa Teriyaki","Teriyaki Sauce","Teriyaki Sauce","KIKKOMAN","296","","USA","3.79lt","USO INSTITUCIONAL","","","NO","Frasco","20,15,6x5,6","526","12","16","","12","SALSA TERIYAKY KIKKOMAN JFC  12x10OZ","Salsa De Soya Naturalmente Fermentada (Agua, Trigo, Frijoles De Soya, Sal), Vino, Jarabe De Maíz De Alta Fructosa, Vinagre, Sal, Especies, Cebolla En Polvo, Acido Succínico, Benzoato De Sodio  ","Salsa Japonesa A Base De Salsa De Soya Endulzada","Marinar O Esparcir Sobre Carnes, Pollos, Pescados Cocidos A La Plancha","","Caja","12","","6,6","21x24x18,5","","4139548","08-1237","USA","KIKKOMAN FOODS INC","USA","SI","","6","JFC","simple","Default","12068,96","Enabled","Catalog, Search","cada 15ml contiene:; proteinas 0,; calorias 20; grasas 0g; carbohidratos 5g; sodio 420 mg ","/productos/salsas/salsa-teriyaki-kikkoman-296ml.jpg","empaque de venta al mayoreo: tipo de empaque: Caja; unidades: ; sub-empaque interno: N.A; peso neto (Kg): 6,312; peso bruto (Kg): 6,6; dimensiones del empaque (cm) (AxAxP): 21x24x18,5","100","1","1" 
"Salsa Teriyaki KIKKOMAN 3.79l","Salsa Teriyaki","Teriyaki Sauce","Teriyaki Sauce","KIKKOMAN","3790","","USA","296ml","USO INSTITUCIONAL","","","NO","Frasco Pet","29X16,5X13","4504","18","16","","12","SALSA TERIYAKY KIKKOMAN JFC  4x1 gal","Salsa De Soya Naturalmente Fermentada (Agua, Trigo, Frijoles De Soya, Sal), Vino, Jarabe De Maíz De Alta Fructosa, Vinagre, Sal, Especies, Cebolla En Polvo, Acido Succínico, Benzoato De Sodio  ","Salsa Japonesa A Base De Salsa De Soya Endulzada","Marinar O Esparcir Sobre Carnes, Pollos, Pescados Cocidos A La Plancha","","Caja","12","","18,75","30x36x28","","41390010446","08-99902","USA","KIKKOMAN FOODS INC","USA","SI","","6","JFC","simple","Default","","Enabled","Catalog, Search","cada 15ml contiene:; proteinas 1g,; calorias 15; grasas 0g; carbohidratos 2g; sodio 610 mg ","/productos/salsas/salsa-teriyaki-kikkoman-3.79L..jpg","empaque de venta al mayoreo: tipo de empaque: Caja; unidades: ; sub-empaque interno: N.A; peso neto (Kg): 54,048; peso bruto (Kg): 18,75; dimensiones del empaque (cm) (AxAxP): 30x36x28","100","1","1" 
"Salsa Teriyaki LEE KUM KEE 250 gm.","Salsa Teriyaki","Teriyaki Sauce","Teriyaki Sauce","LEE KUM KEE","","250","CHINA","","RSiA17M42996","42583","","NO","Frasco","19x4,8X4,8","448","18","16","","12","SALSA TERIYAKI LKK 12x266ml","Azucar,Salsa De Soya,Jengibre,Agua,Vino De Arroz,Sal,Fecula De Maiz Modificada,Color,Extracto De Ostion,Inosinato Disodico,Guanilato Disodico","Salsa Japonesa A Base De Salsa De Soya Endulzada","Marinar O Esparcir Sobre Carnes, Pollos, Pescados Cocidos A La Plancha","","Caja","12","","6,01","20x22x17","","078895120509","1300070223","CHINA","LEE KUM KEE","CHINA","","SI","6","LKK","simple","Default","8620,68","Enabled","Catalog, Search","cada 21g contiene:; proteinas 0,5g; calorias 33Kcal; grasas 0,1g; carbohidratos 0,2g; azucar 7,3g; fibra dietetica 0,1g; sodio 470 mg ","/productos/salsas/salsa-teriyaki-lkk.jpg","empaque de venta al mayoreo: tipo de empaque: Caja; unidades: 12; sub-empaque interno: N.A; peso neto (Kg): 5,376; peso bruto (Kg): 6,01; dimensiones del empaque (cm) (AxAxP): 20x22x17","100","1","1" 
"Salsa Tonkatsu BULLDOG 1.8 lt.","Salsa Tonkatsu","Tomkatsu Sauce","Tomkatsu Sauce","BULLDOG","1800","","USA","","USO INSTITUCIONAL","","","NO","Frasco","28X10X10","2178","18","16","","6","SALSA TONKATSU BULDOG JFC  6 x 1.76 lts","Agua, Jarabe De Maiz De Alta Fructosa, Vinagre Destilado, Sal, Pasta De Tomate, Almidon De Maiz, Pure De Manzana, Almidon De Maiz Modificado, Proteina Vegetal Hidrolizada, Zanahoria, Especias, Colorante Caramelo, Concentrado De Cebola ","Salsa Japonesa A Base De Salsa De Soya Y Frutas Dulces","Salsa O Dip Para Cerdo Apanado O Tonkatsu","","Caja","6","","13,55","33x35x23","","78781104324","08-99903","JAPON","BULL DOG SAUCE CO LTD","USA","SI","","6","JFC","simple","Default","","Enabled","Catalog, Search","cada 15ml contiene:; proteinas 0,; calorias 20; grasas 0g; carbohidratos 5g; sodio 420 mg ","/productos/salsas/salsa-tomkatsu-bulldog1.8Lt.jpg","empaque de venta al mayoreo: tipo de empaque: Caja; unidades: 6; sub-empaque interno: N.A; peso neto (Kg): 13,068; peso bruto (Kg): 13,55; dimensiones del empaque (cm) (AxAxP): 33x35x23","100","1","1" 
"Salsa Vegetariana Para Saltear LEE KUM KEE 510 gm.","Salsa Vegetariana Para Saltear","Vegetarian Stir-Fry Sauce","Vegetarian Stir-Fry Sauce, Vegetarian Oyster Sauce","LEE KUM KEE","","510","CHINA","","RSiA17M42996","42583","","NO","Frasco","25x7x7","806","24","16","","12","SALSA VEGETARIANA LKK 12x510Gr ","Agua,Azucar,Sal,Almidon De Maiz Modificado,Azucar Morena,Frijol De Soya,Harina De Trigo,Color,Sabor Champiñon,Conservante","Salsa A Base De Honggos Y Vegetales Usado Como Sustituto De La Salsa De Ostras Para Vegetarianos","Salteados De Vegetales","","Caja","12","","10,31","26x28x20","","078895100853","01-20523","CHINA","LEE KUM KEE","CHINA","SI","","6","LKK","simple","Default","14655,17","Enabled","Catalog, Search","","/productos/salsas/salsa-vegetariana.jpg","empaque de venta al mayoreo: tipo de empaque: Caja; unidades: 12; sub-empaque interno: N.A; peso neto (Kg): 9,672; peso bruto (Kg): 10,31; dimensiones del empaque (cm) (AxAxP): 26x28x20","100","1","1" 
