"Panko DYNASTY 99 g.","Panko","Japanese Bread Crumbs","Japanese Bread Crumbs, Miga De Pan Japonesa","DYNASTY","","99","USA","9.07kg","RSiA11I50111","44321","","NO","Caja","15,4x11,5x3,6","130","12","10","","12","PANKO DYNASTY 12X3.5 OZ ","Harina De  Trigo Blanqueada, Dextrosa,  Aceite De Soya Parcialmente Hidrogenado, Levadura Y Sal","Miga De Pan Estilo Japones Para Uso Domestico","Para Empanar Carnes Y Mariscos","","Caja","12","","1,8","16,5x24,3x24","","11152096452","400","USA","JFC INTERNATIONAL INC","USA","SI","","15","JFC","simple","Default","6818,18","Enabled","Catalog, Search","cada 28g contiene:; proteinas 3g; grasas 0,5g; carbohidratos 19g; sodio 90mg; calorias: 100","/productos/arroces_y_harinas/panko-dynasty.jpg","empaque de venta al mayoreo: tipo de empaque: Caja; unidades: 12; sub-empaque interno: N.A; peso neto (Kg): 1,56; peso bruto (Kg): 1,8; dimensiones del empaque (cm) (AxAxP): 16,5x24,3x24","100","1","1" 
"Panko WEL-PAC 9.07 kg.","Panko","Japanese Bread Crumbs","Japanese Bread Crumbs, Miga De Pan Japonesa","WEL-PAC","","9070","USA","99g","RSiA11I50111","44321","","NO","Bolsa","78x42,22","9255","12","10","","1","PANKO JFC x 9.07 kl","Harina De  Trigo Blanqueada, Dextrosa,  Aceite De Soya Parcialmente Hidrogenado, Levadura Y Sal","Miga De Pan Estilo Japones Para Uso En Restaurantes","Para Empanar Carnes Y Mariscos","","Bolsa","1","","","","","890749001037","08-99907","USA","JFC INTERNATIONAL INC","USA","SI","","15","JFC","simple","Default","","Enabled","Catalog, Search","cada 28g contiene:; proteinas 3g; grasas 0,5g; carbohidratos 19g; sodio 90mg; calorias: 100","/productos/arroces_y_harinas/panko-wel-pac-9.07k.jpg","empaque de venta al mayoreo: tipo de empaque: Bolsa; unidades: 1; sub-empaque interno: N.A; peso neto (Kg): ; peso bruto (Kg): ; dimensiones del empaque (cm) (AxAxP): ","100","1","1" 
"Papel De Arroz 16"" BEST CHOICE 250 g.","Papel De Arroz 16","Rice Paper","Rice Paper, Bahn Trang","BEST CHOICE","","250","TAILANDIA","400g","RSiA10I21303","41561","","NO","Bolsa","16,5x16,5x1,3","260","24","10","","48","RICE PAPER 16 CM BEST CH THAI  24x250gr","Harina De Arroz, Agua Y Sal","Lamina Fina Seca De Harina De Arroz Con Diametro De 16""","Para Hacer Spring Rolls Frescos (Sin Freir)","","Caja","48","","13,06","21,5x34,5x34,5","","7707298470111","02-00007","TAILANDIA","THREE BILLION TRADING","TAILANDIA","SI","","7","THAI","simple","Default","10909,09","Enabled","Catalog, Search","cada 28g contiene:; proteinas 0g; grasas 0g; carbohidratos 19g; sodio 8mg; coleserol 0g","/productos/pastas/papel-de-arroz-best-choice-16cm.jpg","empaque de venta al mayoreo: tipo de empaque: Caja; unidades: 48; sub-empaque interno: N.A; peso neto (Kg): 12,48; peso bruto (Kg): 13,06; dimensiones del empaque (cm) (AxAxP): 21,5x34,5x34,5","100","1","1" 
"Papel De Arroz 22"" BEST CHOICE 400 g.","Papel De Arroz 22","Rice Paper","Rice Paper, Bahn Trang","BEST CHOICE","","300","TAILANDIA","250g","RSiA10I21303","41561","","NO","Bolsa","22x22x1","308","24","10","","48","RICE PAPER 22CM BEST CHOICE THAI 10x300G","Harina De Arroz, Agua Y Sal","Lamina Fina Seca De Harina De Arroz Con Diametro De 22""","Para Hacer Spring Rolls Frescos (Sin Freir)","","Caja","48","","15,86","28,5x47x24,5","","7707298470128","15-70125","TAILANDIA","THREE BILLION TRADING","TAILANDIA","","SI","7","THAI","simple","Default","11818,18","Enabled","Catalog, Search","cada 28g contiene:; proteinas 0g; grasas 0g; carbohidratos 19g; sodio 8mg; coleserol 0g","/productos/pastas/papel-de-arroz-best-choice-22cm.jpg","empaque de venta al mayoreo: tipo de empaque: Caja; unidades: 48; sub-empaque interno: N.A; peso neto (Kg): 14,784; peso bruto (Kg): 15,86; dimensiones del empaque (cm) (AxAxP): 28,5x47x24,5","100","1","1" 
"Pappadum LIJJAT 200 g.","Papadum","Pappadums","Pappadums, Pappad","LIJJAT PAPAD","","200","TAILANDIA","","USO INSTITUCIONAL","","","NO","Bolsa","16X16X2","196","12","16","","80","GAETA UDAD PAPADS THAI 80x200Gr","Harina Udad-Dal, Asafetida, Sal, Aceite Vegetal, Papad Khar","Pan Tipo Tortilla Originario De La India Hecha Con Harina De Lenteja","Para Hacer Uno De Los Panes Que Acompaña La Comida De La India","","Caja","80","","16,7","27,5x37x29,5","","","04-11018","TAILANDIA","PAPAD LIJJAT","TAILANDIA","SI","","15","THAI","simple","Default","10344,82","Enabled","Catalog, Search","cada 100g contiene:; proteinas 20,34g; grasas 0,66g; carbohidratos 59,02g; sodio 1390mg; coleserol 0mg; azucar: 0g; calorias: 326","/productos/arroces_y_harinas/pappadum.jpg","empaque de venta al mayoreo: tipo de empaque: Caja; unidades: 80; sub-empaque interno: N.A; peso neto (Kg): 15,68; peso bruto (Kg): 16,7; dimensiones del empaque (cm) (AxAxP): 27,5x37x29,5","100","1","1" 
"Pappadum PATAK'S  100 g.","Tortilla India De Lenteja","Pappadums","Pappadums","PATAK'S","","100","INGLATERRA","","RSiA11I53611","44500","","NO","Frasco","17x18x2","150","18","16","","12","TORTILLA INDIA DE LENTEJA PATAK´S 12X10H","Harina De Lenteja,Sal,Bicarbonato De Sodio,Harina De Arroz,Aceite Vegetal","Pan Tipo Tortilla Originario De La India Hecha Con Harina De Lenteja","Para Hacer Uno De Los Panes Que Acompaña La Comida De La India","","Caja","12","","1,94","17,5x18x32","","5011308953009","NAL401","INGLATERRA","PATAK'S","INGLATERRA","SI","","15","PATAKS","simple","Default","6896,55","Enabled","Catalog, Search","cada 100g contiene:; proteinas 20,1g; grasas 0,8g; carbohidratos 59g; sodio 2,03g; calorias: 236Kcal","/productos/arroces_y_harinas/Pappadums-pataks.jpg","empaque de venta al mayoreo: tipo de empaque: Caja; unidades: 12; sub-empaque interno: N.A; peso neto (Kg): 1,8; peso bruto (Kg): 1,94; dimensiones del empaque (cm) (AxAxP): 17,5x18x32","100","1","1" 
"Pasta China SWALLOW 400 g.","Pasta China","Chinese Noodle","Chinese Noodle, Pasta De Huevo","SWALLOW","","400","TAILANDIA","","USO INSTITUCIONAL","","","NO","Bolsa","22x14x5,5","394","24","10","","40","CHINESE NOODLE  THAI 40x400g","Huevo, Harina De Trigo, Agua, Sal","Fideo Largo Hecho Con Trigo Y Huevo Tipo Chino","Para Stir Fry Y Sopas","","Caja","40","","17,4","22x48x43,5","","8854858004015","04-4015","TAILANDIA","SENGHENG NOODLE FACTORY LIMITED","TAILANDIA","SI","","7","THAI","simple","Default","8181,81","Enabled","Catalog, Search","cada 25g contiene:; proteinas 3g; grasas 0g; carbohidratos 19g; sodio 400mg; calorias: 90","/productos/pastas/pasta-china.jpg","empaque de venta al mayoreo: tipo de empaque: Caja; unidades: 40; sub-empaque interno: N.A; peso neto (Kg): 15,76; peso bruto (Kg): 17,4; dimensiones del empaque (cm) (AxAxP): 22x48x43,5","100","1","1" 
"Pasta Chu Hou LEE KUM KEE 240 g.","Pasta Chu Hou","Chu Hou Paste","Chu Hou Paste","LEE KUM KEE","","240","CHINA","","USO INSTITUCIONAL","","","NO","Frasco","9x6,5x6,5","426","18","16","","12","CHU HOU PASTE LKK 12x 360 Gr ","Pasta De Frijoles De Soya Fermentados, (Agua, Sal, Frijol De Soya, Trigo), Azucar Blanca, Agua, Ajos, Pasta De Ajonjoli, Cuajada De Soya Blanca Fermentada (Frijol De Soya, Vinagre De Arroz, Salsa, Aji), Extracto De Lavadura, Aceite De Soya, Sal, Jengibre, Maicena Fortificada, Color Caramelo, Especias, Frijol De Soya, Trigo","Pasta Hecha De La Mejor Calidad De Fríjol Soya, Ajos, Jengibre Y Semillas De Sésamo","Para Preparar Estofados Chinos De Carne Y Ahogados De Vegetales","","Bandeja","12","","5,13","9,4x28,5x21","","078895939552","01-39552","CHINA","LEE KUM KEE","CHINA","SI","","6","LKK","simple","Default","10344,82","Enabled","Catalog, Search","","/productos/salsas/pasta-chu-hou.jpg","empaque de venta al mayoreo: tipo de empaque: Bandeja; unidades: 12; sub-empaque interno: N.A; peso neto (Kg): 5,112; peso bruto (Kg): 5,13; dimensiones del empaque (cm) (AxAxP): 9,4x28,5x21","100","1","1" 
"Pasta Curry Biryani PATAK'S 283 g.","Pasta Curry Variedad Biryani","Biryani Paste","Biryani Paste","PATAK'S","","283","INGLATERRA","","RSiA07I7111","44500","","NO","Frasco","12x5x5","500","36","16","","6","PASTA CURRY BIRYANI PATAK´S 6X283","Agua,Aceite Vegetal,Cilantro,Comino,Genjibre,Sal,Azucar,Curcuma,Aji,Ajo,Especia,Acido Acetico,Acidocitrico","Mezcla Base En Forma De Pasta Para Preparar El Arroz Biryani De La Cocina De La India","Preparacion De Arroz Biryani","","Bandeja","6","","3,2","12.5x20.5x13.5","","5011308002301","BAF071","INGLATERRA","AB WORLD FOODS","INGLATERRA","","SI","6","PATAKS","simple","Default","11206,89","Enabled","Catalog, Search","cada 100g contiene:; proteinas 3,7g; calorias 237Kcal; grasas 18,6g; carbohidratos 5,7g; azucar 4,3g; fibra 7,8g; sodio 1,34g ","/productos/salsas/Pasta-de-curry-biryani.jpg","empaque de venta al mayoreo: tipo de empaque: Bandeja; unidades: 6; sub-empaque interno: N.A; peso neto (Kg): 3; peso bruto (Kg): 3,2; dimensiones del empaque (cm) (AxAxP): 12.5x20.5x13.5","100","1","1" 
"Pasta Curry Butter Chicken PATAK'S 312 g.","Pasta Curry Para Pollo","Butter Chicken Paste","Butter Chicken Paste","PATAK'S","","312","INGLATERRA","","RSiA07I7111","44500","","NO","Frasco","12x5x5","529","36","16","","6","PASTA CURRY PARA POLLO PATAK´S 6X312","Agua,Azucar,Pure De Tomate Concentrado,Almidon De Maiz,Tamarindo,Sa,Harina De Maiz,Polvo De Cebolla,Polvo De Ajo,Ajo,Especias,Sabores Y Colores Naturales,Acido Acetico,Acido Citrico","Mezcla Base De Curry En Forma De Pasta Para Preparar El Plato Butter Chicken,  De La Cocina De La India","Preparacion De Salsa Para Curry Pollo A La Mantequilla","","Bandeja","6","","3,2","12.5x20.5x13.5","","69276332482","BAF089","INGLATERRA","AB WORLD FOODS","INGLATERRA","","SI","6","PATAKS","simple","Default","11206,89","Enabled","Catalog, Search","cada 100g contiene:; proteinas 1g; calorias 60Kcal; grasas 0,4g; carbohidratos 5g; azucar 6g; fibra 1g; sodio 0,46g ","/productos/salsas/Pasta-de-curry-para-pollo.jpg","empaque de venta al mayoreo: tipo de empaque: Bandeja; unidades: 6; sub-empaque interno: N.A; peso neto (Kg): 3,174; peso bruto (Kg): 3,2; dimensiones del empaque (cm) (AxAxP): 12.5x20.5x13.5","100","1","1" 
"Pasta Curry Korma PATAK'S 290 g.","Pasta Curry Variedad Korma","Korma Curry Paste","Korma Curry Paste","PATAK'S","","290","INGLATERRA","","RSiA07I7111","44500","","NO","Frasco","12x5x5","507","36","16","","6","PASTA CURRY KORMA PATAK´S 6X290","Agua,Coco Deshidratado,Aceite Vegetal,Azucar,Pure De Tomate Concentrado,Genjibre,Cilantro,Comino,Sal,Curcuma,Ajo,Curcuma,Almidon De Maiz,Hoja De Cilantro Deshidratada,Especias,Acido Acetico,Acido Citrico","Mezcla Base De Curry En Forma De Pasta Para Preparar El Plato Curry Korma,  De La Cocina De La India","Preparacion De Curry Korma","","Bandeja","6","","3,2","12.5x20.5x13.5","","5011308000314","BAF079","INGLATERRA","AB WORLD FOODS","INGLATERRA","","SI","6","PATAKS","simple","Default","11206,89","Enabled","Catalog, Search","cada 100g contiene:; proteinas 3g; calorias 219Kcal; grasas 17g; carbohidratos 2,4g; azucar 8,8g; fibra 10,8g; sodio 1,32g ","/productos/salsas/Pasta-de-curry-korma.jpg","empaque de venta al mayoreo: tipo de empaque: Bandeja; unidades: 6; sub-empaque interno: N.A; peso neto (Kg): 3,042; peso bruto (Kg): 3,2; dimensiones del empaque (cm) (AxAxP): 12.5x20.5x13.5","100","1","1" 
"Pasta Curry Madras PATAK'S 283 g.","Pasta Curry Variedad Madras","Madras Curry Paste","Madras Curry Paste","PATAK'S","","283","INGLATERRA","","RSiA07I7111","44500","","NO","Frasco","12x6,5x6,5","495","36","16","","6","PASTA CURRY MADRAS PATAK´S 6X283","Agua,Aceite Vegetal,Cilantro,Comino,Curcuma.Aji,Sal,Almidon Demaiz,Genjibre Molido,Tamarindo,Ajo En Polvo,Especias,Acido Acetico,Acido Lactico,Acido Citrico","Mezcla Base De Curry En Forma De Pasta Para Preparar El Plato Curry Madras,  De La Cocina De La India","Preparacion De Curry Madras","","Bandeja","6","","3,2","12.5x20.5x13.5","","5011308002400","BAF073","INGLATERRA","AB WORLD FOODS","INGLATERRA","","SI","6","PATAKS","simple","Default","11206,89","Enabled","Catalog, Search","cada 100g contiene:; proteinas 10,8g; calorias 289Kcal; grasas 25,9g; carbohidratos 5,5g; azucar 2,1g; fibra 10,8g; sodio 1,6g ","/productos/salsas/Pasta-de-curry-madras.jpg","empaque de venta al mayoreo: tipo de empaque: Bandeja; unidades: 6; sub-empaque interno: N.A; peso neto (Kg): 2,97; peso bruto (Kg): 3,2; dimensiones del empaque (cm) (AxAxP): 12.5x20.5x13.5","100","1","1" 
"Pasta Curry Suave PATAK'S 283 g.","Pasta Curry Suave","Mild Curry Paste","Mild Curry Paste","PATAK'S","","283","INGLATERRA","","RSiA07I7111","44500","","NO","Frasco","12x5x5","500","36","16","","6","PASTA CURRY SUAVE PATAK´S 6X312","Agua,Aceite Vgegetal,Cilantro,Comino,Curcuma,Pure De Tomate Concentrado,Sal,Almidon De Maiz,Genjibre Molido,Tamarindo,Polvo De Ajo,Especias,Acido Acetico,Acido Lactico,Acido Citrico","Mezcla Base De Curry En Forma De Pasta Para Preparar El Plato Curry Suave,  De La Cocina De La India","Preparacion De Curry Suave","","Bandeja","6","","3,2","12.5x20.5x13.5","","5011308001601","BAF055","INGLATERRA","AB WORLD FOODS","INGLATERRA","","SI","6","PATAKS","simple","Default","11206,89","Enabled","Catalog, Search","cada 100g contiene:; proteinas 4,8g; calorias 283Kcal; grasas 24,6g; carbohidratos 5,8g; azucar 3,3g; fibra 10,7g; sodio 1,37 g ","/productos/salsas/Pasta-de-curry-mild.jpg","empaque de venta al mayoreo: tipo de empaque: Bandeja; unidades: 6; sub-empaque interno: N.A; peso neto (Kg): 3; peso bruto (Kg): 3,2; dimensiones del empaque (cm) (AxAxP): 12.5x20.5x13.5","100","1","1" 
"Pasta Curry Tandoori PATAK'S 312 g.","Pasta Curry Variedad Tandoori","Tandoori Paste","Tandoori Paste","PATAK'S","","312","INGLATERRA","","RSiA07I7111","44500","","NO","Frasco","12x5x5","529","36","16","","6","PASTA CURRY TANDOORI PATAK´S 6X312","Agua,Genjibre,Tamarindo,Sal,Ajo En Polvo,Cilantro,Comino,Especias,Color Natural,Colores Artificiales,Acido Acetico,Acido Lactico","Mezcla Base De Condimentos En Forma De Pasta Para Preparar El Pollo Al Horno Tandoori","Preparacion De Curry Tandoori","","Bandeja","6","","3,3","12.5x20.5x13.5","","5011308002202","BAF069","INGLATERRA","AB WORLD FOODS","INGLATERRA","","SI","6","PATAKS","simple","Default","11206,89","Enabled","Catalog, Search","cada 100g contiene:; proteinas 3,6g; calorias 93Kcal; grasas 2,5g; carbohidratos 6,3g; azucar 4,2g; fibra 5,7g; sodio 2,26g ","/productos/salsas/Pasta-de-curr-tandoori.jpg","empaque de venta al mayoreo: tipo de empaque: Bandeja; unidades: 6; sub-empaque interno: N.A; peso neto (Kg): 3,174; peso bruto (Kg): 3,3; dimensiones del empaque (cm) (AxAxP): 12.5x20.5x13.5","100","1","1" 
"Pasta Curry Tikka Masala PATAK'S 283 g.","Pasta Curry Variedad Tikka Masala","Tikka Masala Paste","Tikka Masala Paste","PATAK'S","","283","INGLATERRA","","RSiA07I7111","44500","","NO","Frasco","12x6,5x6,5","500","36","16","","6","PASTA CURRY TIKKA MASALA PATAK´S 6X283 ","Agua,Aceite Vegetal,Pure De Tomate Concentrado,Jugo De Limon,Cilantro,Curcuma,Azucar,Cebolla Deshidrata,Genjibre,Coco Deshidratado,Sal,Almidon De Maiz,Ajos,Hoja Deshidratada De Cilantro,Color Natural,Extracto De Paprika,Espacias,Acido Acetico,Acido Lactico","Mezcla Base De Curry En Forma De Pasta Para Preparar El Plato Curry Tikka Masala,  De La Cocina De La India","Preparacion Curry Tikka Masala","","Bandeja","6","","3,2","12.5x20.5x13.5","","5011308000994","BAF083","INGLATERRA","AB WORLD FOODS","INGLATERRA","","SI","6","PATAKS","simple","Default","11206,89","Enabled","Catalog, Search","cada 100g contiene:; proteinas 3,5g; calorias 264Kcal; grasas 20g; carbohidratos 6g; azucar 10g; fibra 6,1g; sodio 1,28g ","/productos/salsas/Pasta-de-curry-tikka-masala.jpg","empaque de venta al mayoreo: tipo de empaque: Bandeja; unidades: 6; sub-empaque interno: N.A; peso neto (Kg): 3; peso bruto (Kg): 3,2; dimensiones del empaque (cm) (AxAxP): 12.5x20.5x13.5","100","1","1" 
"Pasta Curry Vindaloo PATAK'S 283 g.","Pasta Curry Variedad Vindaloo","Vindaloo Curry Paste","Vindaloo Curry Paste","PATAK'S","","283","INGLATERRA","","RSiA07I7111","44500","","NO","Frasco","12X6,5X6,5","500","36","16","","6","PASTA CURRY VINDALOO PATAK´S 6X283","Agua,Aceite Vegetal,Cilantro,Comino,Curcuma.Aji,Sal,Almidon Demaiz,Genjibre Molido,Almidon De Maiz,Tamarindo,Ajo En Polvo,Especias,Acido Acetico,Acido Lactico,Acido Citrico","Mezcla Base De Curry En Forma De Pasta Para Preparar El Plato Curry Vindaloo,  De La Cocina De La India","Preparacion Curry Vindaloo","","Bandeja","6","","3,2","12.5x20.5x13.5","","5011308001700","BAF059","INGLATERRA","AB WORLD FOODS","INGLATERRA","","SI","6","PATAKS","simple","Default","","Enabled","Catalog, Search","cada 100g contiene:; proteinas 4,2g; calorias 273Kcal; grasas 24,4g; carbohidratos 5,4g; azucar 2,1g; fibra 10,3g; sodio 1,28g ","/productos/salsas/Pasta-de-curry-vindaloo.jpg","empaque de venta al mayoreo: tipo de empaque: Bandeja; unidades: 6; sub-empaque interno: N.A; peso neto (Kg): 3; peso bruto (Kg): 3,2; dimensiones del empaque (cm) (AxAxP): 12.5x20.5x13.5","100","1","1" 
"Pasta De Curry Extra Picante PATAK'S 283 g.","Pasta De Curry Extra Picante","Extra Hot Curry Paste","Extra Hot Curry Paste","PATAK'S","","283","INGLATERRA","","RSiA07I7111","44500","","NO","Frasco","12x6,5x6,5","492","36","16","","6","PASTA CURRY EXTRA PICANTE PATAK´S 6X283 ","Agua,Aceite Vegetal,Aceite,Comino,Sal,Almidon De Maiz,Curcuma,Aji,Azucar,Genjibre Molido,Tamarindo,Ajo En Polvo,Especias,Acido Acetico,Acido Lactico,Acido Citrico","Mezcla Base De Curry En Forma De Pasta Para Preparar El Plato Curry Extra Picante,  De La Cocina De La India","Preparacion Curry Picante","","Bandeja","6","","3,2","12.5x20.5x13.5","","5011308000994","BAF051","INGLATERRA","AB WORLD FOODS","INGLATERRA","","SI","6","PATAKS","simple","Default","11206,89","Enabled","Catalog, Search","cada 100g contiene:; proteinas 4,4g; calorias 278Kcal; grasas 24,8g; carbohidratos 4,7g; azucar 3g; fibra 10,7g; sodio 1,2g ","/productos/salsas/pasta-de-curry-extra-picante.jpg","empaque de venta al mayoreo: tipo de empaque: Bandeja; unidades: 6; sub-empaque interno: N.A; peso neto (Kg): 2,952; peso bruto (Kg): 3,2; dimensiones del empaque (cm) (AxAxP): 12.5x20.5x13.5","100","1","1" 
"Pasta Picante MAE PRANOM 456 g.","Pasta Picante","Chili Paste","Chili Paste","MAE PRANOM","","456","TAILANDIA","","USO INSTITUCIONAL","","","NO","Frasco","10,5x8,3x8,3","742","24","16","","12","PASTA DE CHILE THAI 12x460g ","Aceite Vegetal, Camaron Deshidratado, Chile Deshidratado, Cebolla, Ajo, Tamarindo, Azucar, Sal, Pasta De Camaron","Pasta Picante Tipo Tailandes","Dips Y Salsas Picantes, Salteados Tai Con Pollo, Cerdo, Verduras, O Mariscos","","Caja","12","","9,2","12x36x27","","8850487001142","20120","TAILANDIA","MAE PRANOM THAI CHILI PASTE CO LTD","TAILANDIA","SI","","6","THAI","simple","Default","","Enabled","Catalog, Search","","/productos/salsas/pasta-de-chile.jpg","empaque de venta al mayoreo: tipo de empaque: Caja; unidades: 12; sub-empaque interno: N.A; peso neto (Kg): 8,904; peso bruto (Kg): 9,2; dimensiones del empaque (cm) (AxAxP): 12x36x27","100","1","1" 
"Salsa De Tamarindo TALAD THAI 250 g.","Pasta Tamarindo","Tamarind Paste","Tamarind Paste","TALAD THAI","","250","TAILANDIA","2kg","USO INSTITUCIONAL","","","NO","Frasco","10,5x6,5x6,5","435","24","16","","24","PASTA DE TAMARINDO THAI 24x250Gr","Tamarindo,Agua","Salsa A Base De Pulpa Del Tamarindo Tailandes","Salteados Tai Y Vietnamitas Con Pollo, Cerdo, Verduras O Pescado","","Caja","24","","11","23,5x28,5x22","","8850313000899","05-00899","TAILANDIA","THAIMARKET AGRICULTURE CO","TAILANDIA","SI","","6","THAI","simple","Default","12931,03","Enabled","Catalog, Search","cada 12g contiene:; proteinas 0g; calorias 10; grasas 0g; carbohidratos 3g; sodio 90mg","/productos/salsas/pasta-de-tamarindo-250g.jpg","empaque de venta al mayoreo: tipo de empaque: Caja; unidades: 24; sub-empaque interno: N.A; peso neto (Kg): 10,44; peso bruto (Kg): 11; dimensiones del empaque (cm) (AxAxP): 23,5x28,5x22","100","1","1" 
"Picadora Vegetales BENRINER","Picadora Vegetales","Vegetable Slicer","Vegetable Slicer","BENRINER","","1","JAPON","","NO APLICA","","","NO","Caja","18,5X28,4X12,8","750","","16","","1","MAQUINA PARA COCINA ","","Maquinita Para Hacer Hilos De Vegetales O Frutas Duras Como Zanahora, Daikon, Y Manga Biche","Para Picar Frutas Y Verduras En Forma De Hilo","","Caja","1","","","","","","08-10000","JAPON","","JAPON","SI","","13","UTENCILIOS","simple","Default","275862,06","Enabled","Catalog, Search","","/productos/utensilios/picadora-vegetales.jpg","empaque de venta al mayoreo: tipo de empaque: Caja; unidades: 1; sub-empaque interno: N.A; peso neto (Kg): ; peso bruto (Kg): ; dimensiones del empaque (cm) (AxAxP): ","100","1","1" 
"Piedra De Afilar KING K-45","Piedra De Afilar K-45","Sharpening Stone","Sharpening Stone, Whetting Stone","KING","","1","JAPON","","NO APLICA","","","NO","Caja","27,5X9X4,5","392","","16","","12","PIEDRA DE AFILAR K-45","","Piedra Para Afilar Y Pulir Cuchillos Finos","Afilar Cuchillos Finos De Cocina","","Caja","12","","","","","4963188106338","14-15","JAPON","","JAPON","SI","","13","UTENCILIOS","simple","Default","","Enabled","Catalog, Search","","/productos/utensilios/piedra-para-afilar-k45.jpg","empaque de venta al mayoreo: tipo de empaque: Caja; unidades: 12; sub-empaque interno: N.A; peso neto (Kg): ; peso bruto (Kg): ; dimensiones del empaque (cm) (AxAxP): ","100","1","1" 
"Piedra De Afilar KING K-80","Piedra De Afilar K-80","Sharpening Stone","Sharpening Stone, Whetting Stone","KING","","1","JAPON","","NO APLICA","","","NO","Caja","21X5,5X3,2","522","","16","","12","PIEDRA DE AFILAR K-80","","Piedra Para Afilar Y Pulir Cuchillos Finos","Afilar Cuchillos Finos De Cocina","","Caja","12","","","","","4963188104105","13","JAPON","","JAPON","SI","","13","UTENCILIOS","simple","Default","","Enabled","Catalog, Search","","/productos/utensilios/piedra-para-afilar-k80.jpg","empaque de venta al mayoreo: tipo de empaque: Caja; unidades: 12; sub-empaque interno: N.A; peso neto (Kg): ; peso bruto (Kg): ; dimensiones del empaque (cm) (AxAxP): ","100","1","1" 
"Pimienta Sichuan CK","Pimienta Sichuan","Sichuan Pepper","Sichuan Pepper","CD","","1000","TAILANDIA","","USO INSTITUCIONAL","","","NO","Bolsa","31x20x5","1012","24","16","","10","PIMIENTA SICHUAN THAI 10x1Kl","Pimienta Sichuan","Pimienta China Proveniente De La Provincia De Sichuan","Condimentar Carnes Y Sopas","","Caja","10","","10,8","26x43x36","","","05-025","TAILANDIA","CK FOOD TRADING CO","TAILANDIA","SI","","12","THAI","simple","Default","","Enabled","Catalog, Search","","/productos/condimentos/pimienta-sichuan-ck-1k.jpg","empaque de venta al mayoreo: tipo de empaque: Caja; unidades: 10; sub-empaque interno: N.A; peso neto (Kg): 10,12; peso bruto (Kg): 10,8; dimensiones del empaque (cm) (AxAxP): 26x43x36","100","1","1" 
"Pimienta Verde HAND NO. 1  680 g.","Pimienta Verde ","Green Pepper In Brine","Green Pepper In Brine, ","HAND NO. 1","","680","TAILANDIA","","USO INSTITUCIONAL","","","NO","Frasco","15,5X8X8","1106","12","16","","12","PIMIENTA VERDE (Salmuera) THAI 12x680Gr","Pimienta Verde, Agua, Sal Yodada, Vinagre","Pimienta Verde En Salmuera","Para Sopas, Ensaladas, Y Carnes A La Plancha","","Caja","12","","15","19x25x40","","885088541832","04-41832","TAILANDIA","NUANG SOON","TAILANDIA","SI","","12","THAI","simple","Default","19827,58","Enabled","Catalog, Search","cada 35g contiene:; proteinas 0,9g; calorias 30; grasas 0,5g; carbohidratos 5g; sodio 920mg","/productos/condimentos/pimienta-verde-en-salmuera.jpg","empaque de venta al mayoreo: tipo de empaque: Caja; unidades: 12; sub-empaque interno: N.A; peso neto (Kg): 13,272; peso bruto (Kg): 15; dimensiones del empaque (cm) (AxAxP): 19x25x40","100","1","1" 
"Plato De Melamina 10""","Plato De Melamina 10""","Melamine Plate 10""","Melamine Plate 10""","","","1","CHINA","8""","NO APLICA","","","NO","Bolsa","2,7X25X25","238","","16","","160","PLATO MELANINA 10""","","Plato Plano De Melamina De 25Cm De Diametro","Plato","","Caja","160","","","","","","06-686","CHINA","","CHINA","SI","","13","UTENCILIOS","simple","Default","7758,62","Enabled","Catalog, Search","","/productos/utensilios/plato-melamina-10.jpg","empaque de venta al mayoreo: tipo de empaque: Caja; unidades: ; sub-empaque interno: N.A; peso neto (Kg): ; peso bruto (Kg): ; dimensiones del empaque (cm) (AxAxP): ","100","1","1" 
"Plato De Melamina 8""","Plato De Melamina 8""","Melamine Plate 8""","Melamine Plate 8""","","","1","CHINA","10""","NO APLICA","","","NO","Bolsa","2,7X21,5X21,5","","","16","","160","PLATO MELANINA 8"" ","","Plato Plano De Melamina De 20Cm De Diametro","Plato Ensalada","","Caja","160","","","","","","05-685","CHINA","","CHINA","SI","","13","UTENCILIOS","simple","Default","6034,48","Enabled","Catalog, Search","","/productos/utensilios/plato-melamina-8.jpg","empaque de venta al mayoreo: tipo de empaque: Caja; unidades: ; sub-empaque interno: N.A; peso neto (Kg): ; peso bruto (Kg): ; dimensiones del empaque (cm) (AxAxP): ","100","1","1" 
"Ponzu MARUKAN 1.89 lt.","Ponzu Marukan","Citrus Vinegar","Citrus Vinegar","MARUKAN","1890","","USA","","USO INSTITUCIONAL","","","NO","Frasco","25,5X12X12","2026","24","16","","6","PONZU MARUCAN JFC 6x1.89lt","Agua,  Zumo De Pomelo, Vinagre, Acido Citrico, Sal, Escencia De Sudachi, Agua,  Goma Arabe,  Propilengicol, Aceite De Cartamo, Sal, Acido Lactico,  Tocoferoles, Aceite De Pomelo, Curcuma","Salsa A Base De Vinagre, Jugo Citrico, Alga, O Mirin","Aderezos Para Ensaladas, Condimentar Mariscos Y Carnes","","Caja","6","","13,5","29x27x40","","70641066505","16-6650","USA","MARUKAN VINEGAR USA INC","USA","SI","","14","JFC","simple","Default","51724,13","Enabled","Catalog, Search","cada 15ml contiene:; proteinas 0g; calorias 5; grasas 0g; carbohidratos 0,4g; sodio 15mg","/productos/vinagres_y_aceites/vinagre-ponzu-marukan-1.89lt.jpg","empaque de venta al mayoreo: tipo de empaque: Caja; unidades: 12; sub-empaque interno: N.A; peso neto (Kg): 12,156; peso bruto (Kg): 13,5; dimensiones del empaque (cm) (AxAxP): 29x27x40","100","1","1" 
