"Aceite  Ajonjoli Puro LEE KUM KEE 207 ml.","Aceite  Ajonjoli Puro","Pure Sesame Oil","Pure Sesame Oil, Aceite De Sesamo Puro","LEE KUM KEE","207","","CHINA","","RSiA17M44896","42599","","NO","Frasco","19.5x5x5","382","24","16","","12","ACEITE AJONJOLI PURO LKK 12x207ml","Aceite De Ajonjoli ","Aceite De Ajonjoli Tostado ","Aromatizar Ysaborizar.Salteados Al Wok. Utilizase Al Final De La Preparacion","","Caja","12","","4,86","22x22.5x18","","078895710922","01-71092","CHINA","LEE KUM KEE","CHINA","SI","","14","LKK","simple","Default","15517,24","Enabled","Catalog, Search","","/productos/vinagres_y_aceites/aceite-de-ajonjoli-puro-lkk.jpg","empaque de venta al mayoreo: tipo de empaque: Caja; unidades: 12; sub-empaque interno: N.A; peso neto (Kg): 4,584; peso bruto (Kg): 4,86; dimensiones del empaque (cm) (AxAxP): 22x22.5x18","100","1","1" 
"Aceite De Ajonjoli KADOYA 1.575 lt.  ","Aceite De Ajonjoli","Sesame Oil","Sesame Oil","KADOYA","1575","","JAPON","","USO INSTITUCIONAL","","","NO","Lata","17,5x12x9,5","1756","24","16","","10","ACEITE DE AJONJOLI KADOYA JFC 10x56Oz","Aceite De Ajonjoli ","Aceite De Ajonjoli Tostado ","Aromatizar Ysaborizar.Salteados Al Wok. Utilizase Al Final De La Preparacion","","Caja","10","","20","20X27X55","","01282200904","08-00904","JAPÓN","KADOYA SESAME MILLS INC","USA","SI","","14","JFC","simple","Default","54956,89","Enabled","Catalog, Search","cada 14g contiene:; proteinas 0g; calorias 130; grasa 12g; grasa saturada 2g; carbohidratos 0g; sodio 0mg ","/productos/vinagres_y_aceites/aceite-de-ajonjoli-kadoya-1575lt.jpg","empaque de venta al mayoreo: tipo de empaque: Caja; unidades: 10; sub-empaque interno: N.A; peso neto (Kg): 17,56; peso bruto (Kg): 20; dimensiones del empaque (cm) (AxAxP): 20X27X55","100","1","1" 
"Aceite De Ajonjoli Picante LEE KUM KEE 115 ml.","Aceite De Ajonjoli Picante","Hot Blended Sesame Oil","Hot Blended Sesame Oil, Aceite De Sesamo Picante","LEE KUM KEE","115","","CHINA","","RSiA17M44896","42599","","NO","Frasco","14.5x4.5x4.5","228","24","16","","12","ACEITE AJONJOLI PICANTE LKK 12x115ml. ","Aceite De Ajonjoli , Aceite De Soya, Aji En Polvo","Aceite De Ajonjoli Tostado Con Aji Chino","Aromatizar Ysaborizar.Salteados Al Wok. Utilizase Al Final De La Preparacion","","Caja","12","","2,87","16x20x15","","078895138153","01-11530","CHINA","LEE KUM KEE","CHINA","SI","","14","LKK","simple","Default","11206,89","Enabled","Catalog, Search","cada 15ml contiene:; proteinas 0g; calorias 130; grasa 14g; colesterol 0mg; carbohidratos 0g; sodio 0mg ","/productos/vinagres_y_aceites/aceite-de-ajonjoli-picante-lkk.jpg","empaque de venta al mayoreo: tipo de empaque: Caja; unidades: 12; sub-empaque interno: N.A; peso neto (Kg): 2,736; peso bruto (Kg): 2,87; dimensiones del empaque (cm) (AxAxP): 16x20x15","100","1","1" 
"Aceite De Ajonjoli Y Soya LEE KUM KEE 1.75 lt.","Aceite De Ajonjoli Y Soya","Sesame Oil Blended With Soy Bean Oil","Sesame Oil Blended With Soy Bean Oil, Aceite De Sesamo Y Soya","LEE KUM KEE","1750","","CHINA ","207ml","RSiA17M44896","42599","","NO","Frasco Pet","29x10.5x10.5","1728","18","16","","6","ACEITE AJONJOLI Y SOYA LKK 6x1750ml","Aceite De Ajonjoli, Aceite De Soya","Aceite De Ajonjoli Tostado Mezclado Con Aceite De Soya","Aromatizar Ysaborizar.Salteados Al Wok. Utilizase Al Final De La Preparacion","","Caja","6","","9,56","31x35x23.5","","078895709667","1300500095","CHINA ","LEE KUM KEE","CHINA ","SI","","14","LKK","simple","Default","48275,86","Enabled","Catalog, Search","cada 15ml contiene:; proteinas 0g; calorias 130; grasa 14g; grasa saturada 2g; carbohidratos 0g; sodio 0g ","/productos/vinagres_y_aceites/aceite-de-ajonjoli-y-soya-1.75lt-lkk.jpg","empaque de venta al mayoreo: tipo de empaque: Caja; unidades: 6; sub-empaque interno: N.A; peso neto (Kg): 10,368; peso bruto (Kg): 9,56; dimensiones del empaque (cm) (AxAxP): 31x35x23.5","100","1","1" 
"Aceite De Ajonjoli Y Soya LEE KUM KEE 207 ml.","Aceite De Ajonjoli Y Soya","Sesame Oil Blended With Soy Bean Oil","Sesame Oil Blended With Soy Bean Oil, Aceite De Sesamo Y Soya","LEE KUM KEE","207","","CHINA","1.75lt","RSiA17M44896","42599","","NO","Frasco","19.5x5x5","382","24","16","","12","ACEITE AJONJOLI Y SOYA LKK 12x207ml","Aceite De Ajonjoli, Aceite De Soya","Aceite De Ajonjoli Tostado Mezclado Con Aceite De Soya","Aromatizar Ysaborizar.Salteados Al Wok. Utilizase Al Final De La Preparacion","","Caja","12","","5,05","20x22x17","","078895710021","1300500072","CHINA","LEE KUM KEE","CHINA","","SI","14","LKK","simple","Default","10344,82","Enabled","Catalog, Search","cada 15ml contiene:; proteinas 0g; calorias 130; grasa 14g; grasa saturada 2g; carbohidratos 0g; sodio 0g ","/productos/vinagres_y_aceites/aceite-de-ajonjoli- y- soya -207ml-lkk.jpg","empaque de venta al mayoreo: tipo de empaque: Caja; unidades: 12; sub-empaque interno: N.A; peso neto (Kg): 4,584; peso bruto (Kg): 5,05; dimensiones del empaque (cm) (AxAxP): 20x22x17","100","1","1" 
"Ajinomoto Glutamato MSG x 1kg","Glutamato","Monosodium Glutamate","Monosodium Glutamate, Msg","AJI NO MOTO","","1000","BRASIL","","USO INSTITUCIONAL","","","NO","Bolsa","19X15X5","1008","24","16","","","AJI-NO-MOTO GLUTAMATO MSG x 1K","Resaltador De Sabor Glutamato Monosodico ","Glutamato Monosodico","Resaltar El Sabor Natural De La Comida, Especialmente Las Proteinas","","","","","","","","","09-00999","BRASIL","AJINOMOTO DO BRASIL","COLOMBIA","SI","","12","","simple","Default","12931,03","Enabled","Catalog, Search","","","empaque de venta al mayoreo: tipo de empaque: ; unidades: ; sub-empaque interno: N.A; peso neto (Kg): ; peso bruto (Kg): ; dimensiones del empaque (cm) (AxAxP): ","100","1","1" 
"Aceite Mani FLYING DEER 1 lt.","Aceite Mani","Peanut Oil","Peanut Oil, Aceite De Cacahuete","FLYING DEER","1000","","TAILANDIA","","USO INSTITUCIONAL","","","NO","Frasco Pet","27x7,5x7,5","890","18","16","","12","ACEITE MANI THAI 12x1 lt","Aceite De Mani","Aceite De Mani","Freir Y Stir Fry En El Wok Con Altas Temperaturas","","Caja","12","","12,5","30X25X43","","","16-001","TAILANDIA","FLYING DEER BRAND","TAILANDIA","SI","","14","THAI","simple","Default","24568,96","Enabled","Catalog, Search","","/productos/vinagres_y_aceites/aceite-de-mani.jpg","empaque de venta al mayoreo: tipo de empaque: Caja; unidades: 12; sub-empaque interno: N.A; peso neto (Kg): 10,68; peso bruto (Kg): 12,5; dimensiones del empaque (cm) (AxAxP): 30X25X43","100","1","1" 
"Ajonjoli Negro CK 1 kg.","Ajonjoli Negro","Black Sesame","Black Sesame, Sesame Negro","CK","","1000","TAILANDIA","","USO INSTITUCIONAL","","","NO","Bolsa","24x15x5","1010","24","16","","10","AJONJOLI NEGRO THAI 10x1Kl","Ajonjoli Negro","Semilla Seca De Ajonjoli Negro","Para Preparar Urumaki Sushi, Esparcir Sobre Arroz","","Caja","10","","10,58","19x41x27,8","","","05-021","TAILANDIA","CK FOOD TRADING CO","TAILANDIA","SI","","12","THAI","simple","Default","34482,75","Enabled","Catalog, Search","","/productos/condimentos/ajonjoli-negro-ck-1kl.jpg","empaque de venta al mayoreo: tipo de empaque: Caja; unidades: 10; sub-empaque interno: N.A; peso neto (Kg): 10,1; peso bruto (Kg): 10,58; dimensiones del empaque (cm) (AxAxP): 19x41x27,8","100","1","1" 
"Anis Estrellas CK 114 g.","Anis Estrellas","Star Anise","Star Anise","C K","","114","TAILANDIA","","USO INSTITUCIONAL","","","NO","Bolsa","17x15x2","120","24","16","","100","STAR ANISE THAI 100x113Gr","Anis Estrella","Fruta Entera Seca De Anis Estrella ","Aromatizar Estofados De Carne, Sopas, Arroz Biryani Y Mezclas De Especias Como Garam Masala","","Caja","100","","13","35x47x37","","","05-007","TAILANDIA","CK FOOD TRADING CO","TAILANDIA","SI","","12","THAI","simple","Default","2155,17","Enabled","Catalog, Search","","/productos/condimentos/anis-estrellas-ck-114g.jpg","empaque de venta al mayoreo: tipo de empaque: Caja; unidades: 100; sub-empaque interno: N.A; peso neto (Kg): 12; peso bruto (Kg): 13; dimensiones del empaque (cm) (AxAxP): 35x47x37","100","1","1" 
"Arroz Para Sushi BOTAN 22.7 kg.","Arroz Para Sushi","Calrose Sushi Rice","Calrose Sushi Rice, Japonica Rice","BOTAN","","22727","USA","","RSiA10I28105","42039","","NO","Bolsa","60x37x11,5","23050","24","0","","1","ARROZ SUSHI BOTAN JFC x 50lbs","100% Granos De Arroz Mediano","Arroz Mediano Grano Tipo Calrose","Preparacion De Sushi","","Bolsa","1","","","","","011152066301","08-03503","USA","JFC INTERNATIONAL INC","USA","SI","","15","JFC","simple","Default","100000","Enabled","Catalog, Search","cada 42g contiene:; proteinas 3g; calorias 150; grasa 0; carbohidratos 33g; sodio 0mg","/productos/arroces_y_harinas/arroz-para-sushi-botan-50lb.jpg","empaque de venta al mayoreo: tipo de empaque: Bolsa; unidades: 1; sub-empaque interno: N.A; peso neto (Kg): ; peso bruto (Kg): ; dimensiones del empaque (cm) (AxAxP): ","100","1","1" 
"Arroz Para Sushi Organico LUNDBERG 11.3kg","Arroz Organico Para Sushi","Organic Sushi Rice","Organic Sushi Rice, Japonica Rice","LUNDBERG","","11300","USA","","NO APLICA","","","NO","Bolsa","60X28X8,7","11465","12","0","","1","ARROZ SUSHI ORGANICO JFC 25 LB","Arroz Para Suhi Organico California","Arroz Organico De Grano Mediano","Preparacion De Sushi","","Bolsa","1","","","","","073416401617","08-083941","USA","LUNDBERG FAMILY FARMS","USA","SI","","15","JFC","simple","Default","","Enabled","Catalog, Search","cada 45g contiene:; proteinas 4g; calorias 150; grasa 0; carbohidratos 35g; sodio 0mg, colesterol 0mg","/productos/arroces_y_harinas/arroz-para-sushi-organico-lundberg-11.3k.jpg","empaque de venta al mayoreo: tipo de empaque: Bolsa; unidades: 1; sub-empaque interno: N.A; peso neto (Kg): ; peso bruto (Kg): ; dimensiones del empaque (cm) (AxAxP): ","100","1","1" 
"Arroz  HANASYO 22.68kg","Arroz Para Sushi","Sushi Rice","Sushi Rice, Japonica Rice","HANASYO","","22680","USA","","NO APLICA","","","NO","Bolsa","55X36X12","22940","12","0","","1","ARROZ SUSHI HANSYO JFC X 50LB","Arroz Blanco","Arroz De Mediano Grano Tipo Calrose","Preparacion De Sushi","","Bolsa","1","","","","","022772775009","08-05416","JAPON","","USA","SI","","15","JFC","simple","Default","","Enabled","Catalog, Search","cada 45g contiene:; proteinas 3g; calorias 155; grasa 0; carbohidratos 35g; sodio 0mg, colesterol 0mg","/productos/arroces_y_harinas/arroz-para-sushi-hanasyo-50lb.jpg","empaque de venta al mayoreo: tipo de empaque: Bolsa; unidades: 1; sub-empaque interno: N.A; peso neto (Kg): ; peso bruto (Kg): ; dimensiones del empaque (cm) (AxAxP): ","100","1","1" 
"Arroz Para Sushi NISHIKI 22.7 kg.","Arroz Para Sushi","Sushi Rice","Sushi Rice, Japonica Rice","NISHIKI","","22727","USA","907g","RSiA10I28105","42039","","NO","Bolsa","60x37x11,6","23080","24","0","","1","ARROZ SUSHI NISHIKI JFC x 50lbs","100% Granos De Arroz Mediano","Arroz De Mediano Grano","Preparacion De Sushi","","Bolsa","1","","","","","011152012377","08-28580","USA","JFC INTERNATIONAL INC","USA","SI","","15","JFC","simple","Default","","Enabled","Catalog, Search","cada 42g contiene:; proteinas 3g; calorias 150; grasa 0; carbohidratos 33g; sodio 0mg","/productos/arroces_y_harinas/arroz-para-sushi-nishiki-50lb.jpg","empaque de venta al mayoreo: tipo de empaque: Bolsa; unidades: 1; sub-empaque interno: N.A; peso neto (Kg): ; peso bruto (Kg): ; dimensiones del empaque (cm) (AxAxP): ","100","1","1" 
"Arroz Para Sushi NISHIKI 907 g.","Arroz Para Sushi","Sushi Rice","Sushi Rice, Japonica Rice","NISHIKI","","907","USA","22.7kg","RSiA10I28105","42039","","NO","Bolsa","13x18x3","928","24","0","","12","ARROZ SUSHI NISHIKI JFC 12x2lbs","100% Granos De Arroz Mediano","Arroz De Mediano Grano","Preparacion De Sushi","","Caja","12","","11,55","18x27,8x24,5","","011152066301","08-06630","USA","JFC INTERNATIONAL INC","USA","","SI","15","JFC","simple","Default","15000","Enabled","Catalog, Search","cada 42g contiene:; proteinas 3g; calorias 150; grasa 0; carbohidratos 33g; sodio 0mg","/productos/arroces_y_harinas/arroz-para-sushi-2lb.jpg","empaque de venta al mayoreo: tipo de empaque: Caja; unidades: 12; sub-empaque interno: N.A; peso neto (Kg): 11,136; peso bruto (Kg): 11,55; dimensiones del empaque (cm) (AxAxP): 18x27,8x24,5","100","1","1" 
"Azucar De Palma BAN DTAHN BUK 1 kg.","Azucar De Palma","Palm Sugar","Palm Sugar","BAN DTAHNBUK","","1000","TAILANDIA","","USO INSTITUCIONAL","","","NO","Bolsa","20x14x3,5","1004","24","16","","10","AZUCAR PALMA THAI 10x1k","Azucar De Palma","Azucar Derivado De Una Palma Tailandesa En Forma De Sirope Pesado","Postres, Salsas, Y Stir Fry","","Caja","10","","10,34","19x29,5x19,7","","8857103290034","05-031","TAILANDIA","BAN DTAHN BOK","TAILANDIA","SI","","12","THAI","simple","Default","","Enabled","Catalog, Search","","/productos/condimentos/azucar-de-palma.jpg","empaque de venta al mayoreo: tipo de empaque: Caja; unidades: 10; sub-empaque interno: N.A; peso neto (Kg): 10,04; peso bruto (Kg): 10,34; dimensiones del empaque (cm) (AxAxP): 19x29,5x19,7","100","1","1" 
"Azucar De Palma En Panelas CK 454 g.","Azucar De Palma","Palm Sugar Blocks","Palm Sugar Blocks, Coconut Sugar","CK","","454","TAILANDIA","","USO INSTITUCIONAL","","","NO","Bolsa","18x14x4,5","456","24","16","","24","AZUCAR DE PALMA(Panelas)THAI 24x245Gr (04-02000)","Azucar De Palma","Azucar Derivado De Una Palma Tailandesa En Forma Solida","Postres, Salsas, Y Stir Fry","","Caja","24","","11,53","19,5x40,5x27,5","","","04-02000","TAILANDIA","FOOD TRADING CO","TAILANDIA","SI","","12","THAI","simple","Default","","Enabled","Catalog, Search","","/productos/condimentos/azucar-de-palma-panelitas.jpg","empaque de venta al mayoreo: tipo de empaque: Caja; unidades: 24; sub-empaque interno: N.A; peso neto (Kg): 10,944; peso bruto (Kg): 11,53; dimensiones del empaque (cm) (AxAxP): 19,5x40,5x27,5","100","1","1" "Barco En Madera Para Sushi ","Barco Para Sushi","Sushi Boat","Sushi Boat","KKFOOD","","1","TAILANDIA","","NO APLICA","","","NO","Bolsa","","","","16","","1","BARCO PARA SUSHI 18""","","Barco En Madera 68 Cm. De Largo","Para Servir Sushi","","Caja","1","","","","","","05-00020","TAILANDIA","K K FOODS","TAILANDIA","SI","","13","UTENCILIOS","simple","Default","","Enabled","Catalog, Search","","/productos/utensilios/barco-para-sushi.jpg","empaque de venta al mayoreo: tipo de empaque: Caja; unidades: ; sub-empaque interno: N.A; peso neto (Kg): ; peso bruto (Kg): ; dimensiones del empaque (cm) (AxAxP): ","100","1","1" 
"Bonito Flakes  1Lb","Virutas De Bonito Deshidratado","Bonito Flakes","Bonito Flakes, Katsuo","","","500","JAPON","","NO APLICA","","","NO","Bolsa","47X34X5","538","12","16","","5","DRIED SHAVED BONITO JFC 1x 1Lb","Virutas De Bonito Deshidratado","Virutas Deshidratadas Del Pescado Bonito","Preparacion De Caldos Y Salsas Japonesas, Topping De Platos Japoneses","","Caja","5","","4","","","4902833254505","08-55007","JAPON","","USA","SI","","11","JFC","simple","Default","","Enabled","Catalog, Search","cada 2g contiene:; proteinas 1g; calorias 5; grasa 0; carbohidratos 0g; sodio 10mg, colesterol 5mg","/productos/otros/bonito-flakes.jpg","empaque de venta al mayoreo: tipo de empaque: Caja; unidades: 5; sub-empaque interno: N.A; peso neto (Kg): 2,69; peso bruto (Kg): 4; dimensiones del empaque (cm) (AxAxP): ","100","1","1" 
"Bowl De Melamina Con Tapa ","Bowl Con Tapa De Melamina","Melamine Bowl With Cap","Melamine Bowl With Cap, ","","","1","CHINA","","NO APLICA","","","NO","Bolsa","10,1X9,5X9,5","126","","16","","160","BOWL MELANINA CON TAPA","","Bowl Estilo Japones Diametro De 9,5Cm Y Altura De 10Cm.","Para Servir Y Mantener Caliente Sopas Y Arroz","","Caja","160","","","","","","06-684","CHINA","","CHINA","SI","","13","UTENCILIOS","simple","Default","4741,37","Enabled","Catalog, Search","","/productos/utensilios/bowl-con-tapa.jpg","empaque de venta al mayoreo: tipo de empaque: Caja; unidades: 160; sub-empaque interno: N.A; peso neto (Kg): ; peso bruto (Kg): ; dimensiones del empaque (cm) (AxAxP): ","100","1","1" 
"Bowl De Melamina","Bowl De Melamina","Melamine Bowl ","Melamine Bowl","","","1","CHINA","","NO APLICA","","","NO","Bolsa","5,5X11,7X11,7","108","","16","","160","BOWL MELANINA ","","Bowl Estilo Japones Diametro De 11,7Cm Y Altura De 5,5Cm.","Para Servir Ensaladas, Sopas Y Arroz","","Caja","160","","","","","","05-683","CHINA","","CHINA","SI","","13","UTENCILIOS","simple","Default","","Enabled","Catalog, Search","","/productos/utensilios/bowl-melamina2.jpg","empaque de venta al mayoreo: tipo de empaque: Caja; unidades: 160; sub-empaque interno: N.A; peso neto (Kg): ; peso bruto (Kg): ; dimensiones del empaque (cm) (AxAxP): ","100","1","1" 
"Brotes De Bambu CHAOKOH 565 g.","Brotes De Bambu","Bamboo Shoots","Bamboo Shoots, Winter Bamboo Shoots","CHAOKOH","","565","TAILANDIA","","RSiA05l29703","41596","","NO","Lata","11,5x8x8","650","36","16","","24","BROTES DE BAMBU TAJADOS THAI 24x565Gr","Brotes De Bambu, Agua, Acido Citrico Y Eritorbato De Sodio","Brotes Comestibles De La Parte Mas Suave Del Bambu","Ingrediente En Muchas Cocinas Asiaticas Para Stir Fry, Ensaladas","","Caja","24","","16","24,5x35,5x27","","044738219501","04-21950","TAILANDIA","TAILANDIA PODUNG PORN COCONUT","TAILANDIA","","SI","9","THAI","simple","Default","6896,55","Enabled","Catalog, Search","cada 140g contiene:; proteinas 1g; calorias 25; grasa 0; carbohidratos 4g; sodio 14mg; ","/productos/enlatados_y_conservas/brotes-de-bamboo-tajados-chaokoh.jpg","empaque de venta al mayoreo: tipo de empaque: Caja; unidades: 24; sub-empaque interno: N.A; peso neto (Kg): 15,6; peso bruto (Kg): 16; dimensiones del empaque (cm) (AxAxP): 24,5x35,5x27","100","1","1" 
"Cachaza YPIOCA Cristal 1 lt.","Cachaza Cristal X 1 L","Cacha?a","Cacha?a","YPIOCA","1000","","BRASIL","700ml","2005L-0002220","42197","","NO","Frasco ","31,8X8X8","1510","","16","23205","6","CACHAZA CRISTAL YPIOCA 6x1lt (14-0216)","","Aguardiente Brasileiro Hecho De Caña De Azucar Con Contenido Alcoholico De 39%","Preparacion De Caipirinha, Cocteles Con Frutas","","Caja","6","","9,1","34x27x19,3","","7896383700216","14-0216","BRASIL","YPIOCA AGRO-INDUSTRIAL","","","SI","10","LICORES","simple","Default","45000","Enabled","Catalog, Search","","/productos/bebidas/cachaca-crystal- ypioca-1lt.jpg","empaque de venta al mayoreo: tipo de empaque: Caja; unidades: 6; sub-empaque interno: N.A; peso neto (Kg): 9,06; peso bruto (Kg): 9,1; dimensiones del empaque (cm) (AxAxP): 34x27x19,3","100","1","1" 
"Cachaza YPIOCA Cristal 700 ml.","Cachaza Cristal X 700","Cacha?a","Cacha?a","YPIOCA","700","","BRASIL","1lt","2005L-0002220","42197","","NO","Frasco ","29X7X7","1072","","16","15795","6","CACHAZA CRISTAL YPIOCA 6x700ml (14-0315)","","Aguardiente Brasileiro Hecho De Caña De Azucar Con Contenido Alcoholico De 39%","Preparacion De Caipirinha, Cocteles Con Frutas","","Caja","6","","6,67","29,5x16x24","","7896383700315","14-0315","BRASIL","YPIOCA AGRO-INDUSTRIAL","","","SI","10","LICORES","simple","Default","","Enabled","Catalog, Search","","/productos/bebidas/cachaca-crystal- ypioca-700.jpg","empaque de venta al mayoreo: tipo de empaque: Caja; unidades: 6; sub-empaque interno: N.A; peso neto (Kg): 6,432; peso bruto (Kg): 6,67; dimensiones del empaque (cm) (AxAxP): 29,5x16x24","100","1","1" 
"Cachaza YPIOCA Plata  1 lt.","Cachaza Plata X 1 L","Cacha?a","Cacha?a","YPIOCA","1000","","BRASIL","","2005L-0002191","42175","","NO","Frasco ","31,8X8,2X8,2","1530","","16","23205","6","CACHAZA PLATA YPIOCA 6x1lt (14-00049)","","Aguardiente Brasileiro Hecho De Caña De Azucar Con Contenido Alcoholico De 39%, Añejado Por Mas De Dos Años","Preparacion De Caipirinha, Cocteles Con Frutas","","Caja","6","","9,7","34x27x19,3","","7896383700049","14-00049","BRASIL","YPIOCA AGRO-INDUSTRIAL","","","SI","10","LICORES","simple","Default","49000","Enabled","Catalog, Search","","/productos/bebidas/cachaca-prata- ypioca-1lt.jpg","empaque de venta al mayoreo: tipo de empaque: Caja; unidades: 6; sub-empaque interno: N.A; peso neto (Kg): 9,18; peso bruto (Kg): 9,7; dimensiones del empaque (cm) (AxAxP): 34x27x19,3","100","1","1" 
"Castañas De Agua TWIN ELEPHANTS 540 g.","Castañas De Agua","Water Chestnut","Water Chestnut","TWIN ELEPHANTS","","540","TAILANDIA","","USO INSTITUCIONAL","","","NO","Lata","11,5x8x8","630","24","16","","24","CASTAÑAS DE AGUA AD  THAI  24x565g","Castañas De Agua, Agua","Tuberculo Derivado De Una Planta Acuatica Comun En Asia. ","Su Consistencia Crocante Lo Hace Ideal Como Ingrediente Para Platos Stir Fry, Ensaladas, Postres, Y Rellenos Para Bocaditos","","Caja","24","","16","24,5x35,5x27","","8851011117469","04-51013","TAILANDIA","ERAWAN FOOD PUBLIC","TAILANDIA","","SI","9","THAI","simple","Default","11206,89","Enabled","Catalog, Search","cada 110g contiene:; proteinas 0,9g; calorias 50; grasa 0; carbohidratos 11mg; sodio 25mg","/productos/enlatados_y_conservas/castañas-de-agua.jpg","empaque de venta al mayoreo: tipo de empaque: Caja; unidades: 24; sub-empaque interno: N.A; peso neto (Kg): 15,12; peso bruto (Kg): 16; dimensiones del empaque (cm) (AxAxP): 24,5x35,5x27","100","1","1" 
"Cepillo Bambu Para Wok","Cepillo Para Limpiar El Wok En Bambu","Bamboo Wok Brush","Bamboo Wok Brush","KK FOOD","","1","TAILANDIA","","NO APLICA","","","NO","Bolsa","24,2X3,7X3,7","111","","16","","100","CEPILLO DE BAMBOO KK","","Utentsilio Con Cerdas Gruesas De Bambu","Se Utiliza Para Limpiar El Wok De La Comida Que Se Pega En La Coccion.","","Caja","100","","12,5","","","","05-02006","TAILANDIA","K K FOODS","TAILANDIA","","SI","13","UTENCILIOS","simple","Default","","Enabled","Catalog, Search","","/productos/utensilios/cepillo-de-bamboo-para-wok.jpg","empaque de venta al mayoreo: tipo de empaque: Caja; unidades: 100; sub-empaque interno: N.A; peso neto (Kg): 11,1; peso bruto (Kg): 12,5; dimensiones del empaque (cm) (AxAxP): ","100","1","1" 
"Chile Entero Deshidratado CK 500 g.","Chile Deshidratado","Dried Bird Eye Chili","Dried Bird Eye Chili","CK","","500","TAILANDIA","","USO INSTITUCIONAL","","","NO","Bolsa","37X24X4","504","24","16","","20","DRIED BIRD EYE CHILI THAI 20x500Gr","Chiles Deshidratados","Aji Seca Entera De La Variedad Ojo De Pajaro (Bird Eye)","Para Dar Un Toque Picante  Con Trocitos De Aji Autentico Tailandes","","Caja","20","","10,9","36x55,5x37","","","05-008","TAILANDIA","CK FOOD TRADING CO","TAILANDIA","SI","","12","THAI","simple","Default","30172,41","Enabled","Catalog, Search","","/productos/condimentos/chile-entero-deshidratado-ck-500g.jpg","empaque de venta al mayoreo: tipo de empaque: Caja; unidades: 20; sub-empaque interno: N.A; peso neto (Kg): 10,08; peso bruto (Kg): 10,9; dimensiones del empaque (cm) (AxAxP): 36x55,5x37","100","1","1" 
"Chile En Polvo CK 113 g.","Chile En Polvo","Dried Crushed Chili","Dried Crushed Chili","CK","","113","TAILANDIA","","USO INSTITUCIONAL","","","NO","Bolsa","32X23X5","128","24","16","","100","DRIED CRUSHED CHILI THAI 100x113Gr","Chile Deshidratado","Aji Seca Molida De La Variedad Ojo De Pajaro (Bird Eye)","Para Dar Un Toque Picante Autentico Tailandes","","Caja","100","","13,6","26,7x38,5x29,5","","","05-002","TAILANDIA","CK FOOD TRADING CO","TAILANDIA","SI","","12","THAI","simple","Default","6896,55","Enabled","Catalog, Search","","/productos/condimentos/chile-en-polvo-ck-114g.jpg","empaque de venta al mayoreo: tipo de empaque: Caja; unidades: 100; sub-empaque interno: N.A; peso neto (Kg): 12,8; peso bruto (Kg): 13,6; dimensiones del empaque (cm) (AxAxP): 26,7x38,5x29,5","100","1","1" 
"Cinco Especias Chinas  CK 200 g.","Cinco Especias Chinas ","Five Spice Powder","Five Spice Powder","CK","","200","TAILANDIA","200g","USO INSTITUCIONAL","","","NO","Bolsa","15,5x10x3","206","24","16","","50","POLVO 5 ESPECIAS CHINAS THAI 50x200Gr","Hinojo, Semillas De Cilantro, Clavo, Canela, Pimienta Sichuan","Mezcla De 5 Especias Comunmente Usada En La Cocina China: Anis Estrella, Canela, Clavo, Pimienta Y Hinojo.","Aromatizar Y Saborizar Guisos, Estofados, Y Sopas","","Caja","50","","5,1","21,5x44,5x37","","","05-009","TAILANDIA","CK FOOD TRADING CO","TAILANDIA","SI","","12","THAI","simple","Default","14367,81","Enabled","Catalog, Search","","/productos/condimentos/polvo-cinco-especias-chinas-200g.jpg","empaque de venta al mayoreo: tipo de empaque: Caja; unidades: 50; sub-empaque interno: N.A; peso neto (Kg): 10,3; peso bruto (Kg): 5,1; dimensiones del empaque (cm) (AxAxP): 21,5x44,5x37","100","1","1" 
"Cinco Especias Chinas HAND NO. 1   40 g.","Cinco Especias Chinas ","Five Spice Powder","Five Spice Powder","HAND NO. 1","","40","TAILANDIA","40g","USO INSTITUCIONAL","","","NO","Frasco","10x4,7x4,7","172","24","16","","48","POLVO 5 ESPECIAS CHINAS THAI 48x40Gr","Hinojo, Semillas De Cilantro, Clavo, Canela, Pimienta Sichuan","Mezcla De 5 Especias Comunmente Usada En La Cocina China: Anis Estrella, Canela, Clavo, Pimienta Y Hinojo.","Aromatizar Y Saborizar Guisos, Estofados, Y Sopas","","Caja","48","","10","","","8850885291657","05-29165","TAILANDIA","","TAILANDIA","SI","","12","THAI","simple","Default","8189,65","Enabled","Catalog, Search","","/productos/condimentos/polvo-cinco-especias-chinas-40g.jpg","empaque de venta al mayoreo: tipo de empaque: Caja; unidades: 48; sub-empaque interno: N.A; peso neto (Kg): 8,256; peso bruto (Kg): 10; dimensiones del empaque (cm) (AxAxP): ","100","1","1" 
"Clay Pot 7""","Clay Pot En Arcilla","Clay Pot ","Clay Pot ","KK FOOD","","1","TAILANDIA","","NO APLICA","","","NO","Bolsa","","","","16","","15","CLAY POT 7""","","Olla De Barro Con Tapa","Para Servir Y Mantener Caliente Sopas Y Platos Con Salsa  ","","Caja","15","","","","","","05-013","TAILANDIA","THREE BILLION TRADING","TAILANDIA","SI","","13","UTENCILIOS","simple","Default","","Enabled","Catalog, Search","","","empaque de venta al mayoreo: tipo de empaque: Caja; unidades: 15; sub-empaque interno: N.A; peso neto (Kg): ; peso bruto (Kg): ; dimensiones del empaque (cm) (AxAxP): ","100","1","1" 
